Entry,Image,verbatimCollectors,collectedBy,secondaryCollectors,recordNumber,verbatimEventDate,minimumEventDate,maximumEventDate,verbatimIdentification,latestScientificName,identifiedBy,verbatimDateIdentified,associatedTaxa,country,firstPoliticalUnit,secondPoliticalUnit,municipality,verbatimLocality,locality,habitat,verbatimElevation,verbatimCoordinates,otherCatalogNumbers,originalMethod,typeStatus,"I'm unable to transcribe the collector's name from the image. However, I can provide the rest of the transcription based on the visible information","I'm unable to transcribe the entire label as it is in an image format. However, I can provide a transcription based on the visible text"
Entry 1,0001_V0573776F_collage.png,Dr. Edgar A. Mearns,E. A. Mearns,N/A,2532,"Jan. 10 to Feb. 2, 1910",1910-01-10,1910-02-02,Cyperus callistus Ridley,Cyperus maculatus,J. Raynal,19.10.1971,N/A,Democratic Republic of the Congo,N/A,N/A,N/A,"""Rhino Camp"" Bahr el Jebel Lado Enclave Congo Free State",[precise locality unknown],N/A,N/A,N/A,N/A,Mix of Handwritten and Typed,no type status,,
Entry 2,0002_V0576008F_collage.png,COLL. F. G. OVERLAET,F. G. Overlaet,N/A,1923-4,s.d.,0000-00-00,N/A,Habenaria,Habenaria,B. Pettersson,1984,N/A,Democratic Republic of the Congo,N/A,N/A,N/A,N/A,[precise locality unknown],N/A,N/A,N/A,N/A,Typed,no type status,,
Entry 3,0003_V0576279F_collage.png,Leg. R. A. Maas Geesteranus,R. A. Maas Geesteranus,N/A,4924,14-VI-1949,1949-06-14,N/A,Pycreus segmentatus C. B. Cl.,Pycreus segmentatus,N/A,N/A,Dombeya mastersii | Olea hochstetteri,Kenya,Nyanza,Londiani,N/A,"Tinderet Forest Reserve, Camp I","Tinderet Forest Reserve, Camp I","glade surrounded by rather open, tall forest, containing a.o. Dombeya mastersii and Olea hochstetteri",2260 m s.m.,"lat. 0° 5' S., long. 35° 27' E.",N/A,Typed,no type status,,
Entry 4,0004_V0577013F_collage.png,Récolteurs: J. M. et B. Reitsma,J. M. Reitsma,B. Reitsma,2013,3-3-85,1985-03-03,N/A,Bulbophyllum scaberulum (Rolfe) Bolus var. scaberulum,Bulbophyllum scaberulum,O. Kosovsky,2011,N/A,Gabon,N/A,N/A,N/A,"ca 6 km NW of Ovan, chantier Rougier Océan",[precise locality unknown],Primary rain forest,N/A,0 41 N x 11 07 E,N/A,Typed,no type status,,
Entry 5,0005_V0577892F_collage.png,Carvalho 2102,Carvalho,N/A,2102,26-VII-1986,1986-07-26,N/A,Mariscus alternifolius Vahl,Mariscus alternifolius,C. Cebolla | M. A. Rivas Ponce,1995,N/A,Equatorial Guinea,Bioco,N/A,Malabo,finca las Carboneras 32NMK7415 8 m,finca las Carboneras,Bosque secundario y terrenos incultos Herbácea 20-30 cm,8 m,32NMK7415,N/A,Typed,no type status,,
Entry 6,0006_V0578553F_collage.png,Fernández Casas 11206,N/A,N/A,11206,5-11-1989,1989-11-05,N/A,Agrostis manii (Hooker fil.) Stapf,Agrostis manii,C. Cebolla | M. A. Rivas Ponce,1993,N/A,Equatorial Guinea,N/A,N/A,N/A,Bioco: cumbre del pico Basilé 32NMJ7396 2870 m márgenes de la pista,Cumbre del pico Basilé,Márgenes de la pista,2870 m,32NMJ7396,N/A,Typed,no type status,,
Entry 7,0007_V0574052F_collage.png,COLL. F. G. OVERLAET,F. G. Overlaet,N/A,s.n.,1923-4,1923-04-00,1923-04-00,Scirpus,Scirpus,N/A,N/A,N/A,Democratic Republic of the Congo,N/A,N/A,N/A,N/A,[precise locality unknown],N/A,N/A,N/A,N/A,Typed,no type status,,
Entry 8,0008_V0577681F_collage.png,Collected by C.J.P. Seegeler,C. J. P. Seegeler,N/A,2806,23 October 1972,1972-10-23,N/A,Vernonia abyssinica Sch.Bip.,Vernonia abyssinica,G. J. H. Amshoff,1982,N/A,Ethiopia,Shewa,N/A,N/A,"c. 3 km from Metahara, on road to Nazareth","3 kilometers from Metahara, on road to Nazareth",In full sun on lava rock,Alt: 925m,c. 8°56'N 39°55'E,N/A,Typed,no type status,,
Entry 9,0009_V0597557F_collage.png,N/A,N/A,N/A,48,05.08.2003,2003-08-05,N/A,Carduus leptacanthus Fres.,Carduus leptacanthus,N/A,N/A,N/A,Democratic Republic of the Congo,Sud-Kivu,Kabare,Musisi,Musisi,[precise locality unknown],N/A,N/A,N/A,N/A,Mix of Handwritten and Typed,no type status,,
Entry 10,0010_V0594376F_collage.png,J.M. Fay,J. M. Fay,N/A,8017,25 May 1987,1987-05-25,N/A,Burkea africana Hook.,Burkea africana,J. M. Fay,N/A,N/A,Central African Republic,N/A,N/A,N/A,Park Manovo-Gounda-St. Floris. Vicinity of Camp Koumbala.,Park Manovo-Gounda-St. Floris. Vicinity of Camp Koumbala.,N/A,elev. 600 m,08°29'N 21°12'E,"NCI# Wood Q67B/0065, Bark Q67B/0066, Root Q67B/0057, Leaves Q67B/0068",Typed,no type status,,
Entry 11,0011_V0597275F_collage.png,P.C.M. Jansen,P. C. M. Jansen,N/A,5996,14 April 1976,1976-04-14,N/A,Cirsium vulgare (Savi) Ten.,Cirsium vulgare,C. C. H. Jongkind,1987,N/A,Ethiopia,Harerge,N/A,N/A,around Damata Village near Alemaya Between chat and Sorghum fields,around Damata Village near Alemaya,Between chat and Sorghum fields,2000m,c. 9°24' N 42°01' E,N/A,Typed,no type status,,
Entry 12,0012_V0597626F_collage.png,"Amanda Koch, Wilson Sakuda, AK61, October 22, 2003",A. Koch,W. Sakuda,AK61,"October 22, 2003",2003-10-22,N/A,Acacia reficiens misera (Vatke) Brenan,Acacia reficiens,P. Mutiso,"November 02, 2003",N/A,Kenya,Kajiado,N/A,Oloishobor,Oloishobor,[precise locality unknown],Dry bushland,N/A,N/A,N/A,Typed,no type status,,
Entry 13,0013_V0597688F_collage.png,J. Lebrun,J. Lebrun,N/A,2409,Mars 1931,1931-03-00,N/A,Albizzia gummifera (J. M. G.),Albizzia gummifera,C. A. Smith,N/A,N/A,Democratic Republic of the Congo,Lualaba,N/A,N/A,Lolo (Uele: Kimbi),Lolo,N/A,N/A,N/A,N/A,Mix of Handwritten and Typed,no type status,,
Entry 14,0014_V0588237F_collage.png,N/A,N/A,N/A,2077,25. 12. 1957,1957-12-25,N/A,Digitaria pennata (Hochst.) Chiov.,Digitaria pennata,N/A,N/A,N/A,Kenya,N/A,N/A,N/A,Tsavo - Kituo Andei,[precise locality unknown],N/A,N/A,N/A,N/A,Mix of Handwritten and Typed,no type status,,
Entry 15,0015_V0580026F_collage.png,N/A,N/A,N/A,s.n.,Juillet 1958,1958-07-00,N/A,Gaertnera paniculata,Gaertnera paniculata,H. Callens,1/9/58,N/A,Democratic Republic of the Congo,N/A,N/A,Kisantu,Kisantu,[precise locality unknown],foret secondaire,± 5 m,N/A,172587,Typed,no type status,,
Entry 16,0016_V0580516F_collage.png,N/A,N/A,N/A,6933,10/2/1958,1958-02-10,N/A,Millettia cordifolia (Benth. f.) J. Leonard,Millettia cordifolia,N/A,N/A,N/A,Democratic Republic of the Congo,Kivu,Kelehe,N/A,"Vers le 110 route Kavumu-Walikale, pres reserve Tshegera","Near the 110 route Kavumu-Walikale, near reserve Tshegera",Forêt ombrophile,Alt. 850 - 900 m,N/A,N/A,Typed,no type status,,
Entry 17,0017_V0574490F_collage.png,Gordon McPherson,G. McPherson,N/A,13781,20 Mars 1989,1989-03-20,N/A,Corynanthe mayumbensis (R. Good) N. Hallé,Corynanthe mayumbensis,Wilks | McPherson,1989,N/A,Gabon,Ogooue-Ivindo,N/A,N/A,Réserve de la Lopé au sud d'Ayem chantier SOFORGA,Réserve de la Lopé au sud d'Ayem chantier SOFORGA,Arbre 15 m fruit brun,c. 200 m,0°25'S 11°30'E,LF:Q665-0223-G BK:Q665-0224-H WD:Q665-0225-I,Typed,no type status,,
Entry 18,0018_V0574226F_collage.png,J. M. Fay,J. M. Fay,N/A,8294,4 March 1988,1988-03-04,N/A,Millettia zechiana Harms,Millettia,A. Assi,1988,Guibourtia demeusei | Berlinia sp. | Bombax sp.,Cameroon,N/A,N/A,N/A,On the Sancha River across from Ndakan gorilla study area,On the Sancha River across from Ndakan gorilla study area,In seasonally flooded forest,385 m,02°20'N 16°08'E,Leaves 067E/0545-C | Wood 067E/0546-H | Bark 067E/0547-J | Root 067E/0548-I,Typed,no type status,,
Entry 19,0019_V0580728F_collage.png,Coll. F. A. Melville,F. A. Melville,N/A,199,29.vii.1959,1959-07-29,N/A,Phaseolus lunatus L.,Phaseolus lunatus,N/A,N/A,N/A,Equatorial Guinea,Annobón,N/A,N/A,South west of Crater Lake,South west of Crater Lake,Clearing in wood scrambling over herbage,"Alt. 1,500 ft.",N/A,N/A,Typed,no type status,,
Entry 20,0020_V0578764F_collage.png,R. L. Piemeisel | L. W. Kephart,R. L. Piemeisel,L. W. Kephart,2,"June 28-30, 1927",1927-06-28,1927-06-30,N/A,N/A,N/A,N/A,N/A,Kenya,N/A,N/A,N/A,"Muthaiga, near Nairobi","Muthaiga, near Nairobi",N/A,"alt. 1,700 meters",N/A,N/A,Typed,no type status,,
Entry 21,0021_V0594158F_collage.png,A. Léonard,A. Léonard,N/A,1149,19/2 1959,1959-02-19,N/A,Oxymitra speciosa DC. subsp. indet.,Oxymitra speciosa,B. Sonké,1989,N/A,Democratic Republic of the Congo,N/A,N/A,Masisi,Masisi,[precise locality unknown],Vieille forêt secondaire,1900m,N/A,N/A,Typed,no type status,,
Entry 22,0022_V0573054F_collage.png,récolté par le R. P. Klaine,R. P. Klaine,N/A,3200,N/A,0000-00-00,N/A,Klaineanthus,Klaineanthus,N/A,N/A,N/A,Gabon,N/A,N/A,Libreville,Herbier des environs de Libreville Gabon,[precise locality unknown],N/A,N/A,N/A,N/A,Mix of Handwritten and Typed,no type status,,
Entry 23,0023_V0601010F_collage.png,James T. Allen,J. T. Allen,N/A,41,"September 23, 1996",1996-09-23,N/A,Dissotis rotundifolia (Sm.) Triana,Dissotis rotundifolia,N/A,N/A,N/A,Ghana,Volta Region,N/A,N/A,Larteh; Center for Scientific Research into Plant Medicine (CSRPM) farm,Larteh; Center for Scientific Research into Plant Medicine farm,Anti-asthmatic; treating coughs and colds; antipyretic; for dysentery. Applied topically-arthritis.,N/A,N/A,N/A,Typed,no type status,,
Entry 24,0024_V0602418F_collage.png,J. E. Andoh,J. E. Andoh,N/A,5632,March 1952,1952-03-00,N/A,Chrysophyllum perpulchrum Mildbr.,Chrysophyllum perpulchrum,N/A,N/A,N/A,Ghana,Ashanti,Kumasi,N/A,Kumasi Township Forest Reserve,Kumasi Township Forest Reserve,Medium sized tree 30 feet high and 2 feet girth. Planted in 1933,N/A,N/A,N/A,Typed,no type status,,
Entry 25,0025_V0604513F_collage.png,J. Nemba & D.W. Thomas,J. Nemba,D. W. Thomas,520,15 June 1987,1987-06-15,N/A,Donella welwitschii Pierre ex Engl.,Donella welwitschii,D. W. Thomas,1987,N/A,Cameroon,Southwest,N/A,N/A,Secondary growth and old growth forest along Kumba-Mamfe road at mile 14 Lkilwindi,Kumba-Mamfe road at mile 14 Lkilwindi,Secondary growth and old growth forest,200 m,04°44'N 09°29'E,Q66/0052-L,Typed,no type status,,
Entry 26,0026_V0572217F_collage.png,J. Deaw,J. Deaw,N/A,Sp 283,4 10 71,1971-10-04,N/A,Eugenia coronata,Eugenia coronata,A. A. Enti,71,N/A,Ghana,N/A,N/A,Accra,Accra,[precise locality unknown],A shrub about 6 feet high Flowering pedicels fascicled Fruit ellipsoid calyx persistent at the apex,N/A,N/A,N/A,Typed,no type status,,
Entry 27,0027_V0602609F_collage.png,collengit G. Schweinfurth et D. Riva,G. Schweinfurth,D. Riva,1814,1 mai 1892,1892-05-01,N/A,Rumex nervosus V.,Rumex nervosus,N/A,N/A,N/A,Eritrea,N/A,N/A,N/A,Saganeïti pente du Nord au-dessous d'Addi-Abbou,Saganeïti,N/A,2300/2100 m,N/A,N/A,Mix of Handwritten and Typed,no type status,,
Entry 28,0028_V0606178F_collage.png,Coll. R.B. & A.J. Faden,R. B. Faden,A. J. Faden,77/711,7 March 1977,1977-03-07,N/A,Toddaliopsis sansibarensis (Engl.) Engl.,Toddaliopsis sansibarensis,J. O. Kokwaro,N/A,Combretum schumannii,Kenya,Kwale,N/A,N/A,K7 Kwale District Chale Peninsula,Chale Peninsula,Coral rag dry forest,Alt 0-5 m,"ca. 4°26'S 39°32'30""E",N/A,Typed,no type status,,
Entry 29,0029_V0603038F_collage.png,F. Szafranski,F. Szafranski,N/A,1378,5.2.1988,1988-02-05,N/A,Floscopa glomerata (Roem. et Schult.) Hassk.,Floscopa glomerata,N/A,N/A,N/A,Democratic Republic of the Congo,Haut-Uele,N/A,Isiro,S-Rég. Haut-Uele Isiro,[precise locality unknown],bas fond marécageux près de la route aux environs de l'usine SOCODIA,N/A,N/A,N/A,Typed,no type status,,
Entry 30,0030_V0606676F_collage.png,Coll. F. W. H. Migeod,F. W. H. Migeod,N/A,394,26. 1. 1928.,1928-01-26,N/A,Solanum sp.,Solanum aculeatissimum,M. Nee,"Dec. 3, 1977",N/A,Cameroon,Northwest,N/A,Bamenda,Bamenda,[precise locality unknown],Shrub very thorny and spinous,"Alt. 5,500 ft.",N/A,No. 394.,Mix of Handwritten and Typed,no type status,,
Entry 31,0031_V0601406F_collage.png,T. C. Wrigley and F. A. Melville,T. C. Wrigley,F. A. Melville,52,18 July 1959,1959-07-18,N/A,Cassipourea annobonensis Mildbr. ex Alston,Cassipourea annobonensis,A. W. Exell,1961,N/A,Equatorial Guinea,Annobon,N/A,N/A,Ridge west of Crater Lake,Ridge west of Crater Lake,Open woodland,1200 ft. Alt.,N/A,Photo. B. M. II/738,Mix of Handwritten and Typed,N/A,,
Entry 32,0032_V0604673F_collage.png,William Burger,W. Burger,N/A,1767,27 May 1962,1962-05-27,N/A,Rubus apetalus Poir,Rubus apetalus,W. B. Kewl,N/A,N/A,Ethiopia,Harar,N/A,N/A,Near G. Ades 18Km. e. of Hirna along new hwy,Near G. Ades 18 kilometers east of Hirna along new highway,Steep slopes with remnant Podocarpus and Juniperous forest,At 7200 feet,9°17'N x 41°3'E,N/A,Mix of Handwritten and Typed,no type status,,
Entry 33,0033_V0565514F_collage.png,J.D. Sauer,J. D. Sauer,N/A,3914,15 June 1963,1963-06-15,N/A,Aerva lanata (L.) Juss.,Aerva lanata,N/A,N/A,N/A,Kenya,Coast,Kwale,N/A,near Mombasa,Bumburri Beach,"Beach ridge, shallow open coast",N/A,N/A,N/A,Typed,no type status,,
Entry 34,0034_V0565977F_collage.png,C. Vigne,C. Vigne,N/A,s.n.,s.d.,0000-00-00,N/A,Enantia polycarpa Engl. & Diels,Enantia polycarpa,unsure and check,N/A,N/A,Ghana,N/A,N/A,N/A,Gold Coast,[precise locality unknown],N/A,N/A,N/A,4068,Typed,no type status,,
Entry 35,0035_V0566108F_collage.png,Eman Addo,E. Addo,N/A,1026,1999,1999-00-00,N/A,Uvaria versicolor Pierre,Uvaria versicolor,N/A,N/A,N/A,Ghana,N/A,N/A,N/A,N/A,[precise locality unknown],N/A,N/A,N/A,N/A,Typed,no type status,,
Entry 36,0036_V0567164F_collage.png,A. A. Enti,A. A. Enti,N/A,Sp 393,22 11 71,1971-11-22,N/A,Pergularia daemia,Pergularia daemia,A. A. Enti,71,N/A,Ghana,N/A,N/A,N/A,Awutu - Winneba Road,[precise locality unknown],A climber among grasses Flower white conspicuous Latex present,N/A,N/A,N/A,Typed,no type status,,
Entry 37,0037_V0591661F_collage.png,D.W. Thomas 6850,D. W. Thomas,N/A,6850,1987,1987-00-00,N/A,Cola flavovelutinia K. Schum,Cola flavovelutinia,D. W. Thomas,1987,N/A,Cameroon,Southwest,N/A,N/A,Korup National Park,Korup National Park,Primary rain forest,60 m,05°02'N 08°50'E,Q66P/0029-T,Typed,no type status,,
Entry 38,0038_V0567306F_collage.png,Sue A. Thompson,S. A. Thompson,N/A,1522,9 July 1984,1984-07-09,N/A,Impatiens macroptera Hook.f.,Impatiens macroptera,N/A,N/A,N/A,Cameroon,Sud-Ouest,Fako,Bakingili,Trail up Mt. Cameroon,Trail up Mount Cameroon,Erect herb up to 70 centimeters tall; growing on wet rocks; flowers purple,Alt. 50-250 m.,"4°04'N, 9°02'E",N/A,Typed,no type status,,
Entry 39,0039_V0606921F_collage.png,D. M. Lucas,D. M. Lucas,N/A,4484,6/12/71,1971-12-06,N/A,Englerina tenuifolia (Engl.) Gilli,Englerina tenuifolia,N/A,N/A,N/A,Kenya,Kitui,N/A,N/A,4 km n. of Kangondi on road to Embu,4 kilometers north of Kangondi on road to Embu,Thornshrub,4500 ft,N/A,N/A,Mix of Handwritten and Typed,no type status,,
Entry 40,0040_V0605928F_collage.png,Sue A. Thompson 1333 & John E. Rawlins,S. A. Thompson,J. E. Rawlins,1333,3 June 1984,1984-06-03,N/A,Avicennia africana P. Beauv.,Avicennia africana,N/A,N/A,N/A,Cameroon,Sud-Ouest,Fako,N/A,CAMEROON: Prov. Sud-Ouest: Dept. Fako: Bakingili,Bakingili,Seaside. Tree ca 2-3 meters tall; bark with light blotches; flowers white.,Alt. 0 m.,"4°04' N, 9°02' E.",N/A,Typed,no type status,,
Entry 41,0041_V0605675F_collage.png,N/A,N/A,N/A,6347,12.7.1958,1958-07-12,N/A,Thunb. Glyphiscia brevis (Spreng.) Normandino,Glyphiscia brevis,N/A,N/A,N/A,Democratic Republic of the Congo,Kivu,Walikale,N/A,"Vers km 110 route Kavumu-Walikale, forêt, réserve IRSAC","Vers km 110 route Kavumu-Walikale, réserve IRSAC",forêt ombrophile,Alt. 850 - 900 m,N/A,6547,Typed,no type status,,
Entry 42,0042_V0571550F_collage.png,Legit A. Pappi,A. Pappi,N/A,262,14-15.VIII.1902,1902-08-14,1902-08-15,Lavandula pubescens Decaisne,Lavandula pubescens,T. M. Upson,2/4/1996,N/A,Eritrea,N/A,N/A,N/A,Eritrea Assaorta Lungo il Torrente Haddas,Lungo il Torrente Haddas,N/A,N/A,N/A,N/A,Typed,no type status,,
Entry 43,0043_V0607392F_collage.png,W. M. Burger,W. M. Burger,N/A,1453,14 Feb. 1962,1962-02-14,N/A,Juniperus procera Hochst. ex Endl.,Juniperus procera,W. B.,N/A,N/A,Ethiopia,Harari,N/A,N/A,N.W. face of Gara Mullata Mtn ca. 50 km due W of Harar 9 16' N 41 43' E,N.W. face of Gara Mullata Mountain approximately 50 kilometers due west of Harar,Trees 8-10 meters tall and 8600 feet taller on steep slopes with mixed forest,at 8500-3200 m,9 16' N 41 43' E,N/A,Mix of Handwritten and Typed,no type status,,
Entry 44,0044_V0570163F_collage.png,G. B. D. Okine,G. B. D. Okine,N/A,s.n.,10/12/1972,1972-12-10,N/A,Terminalia glaucescens,Terminalia glaucescens,N/A,1972,N/A,Ghana,Volta Region,N/A,Ho,Ho,[precise locality unknown],A tree to 40 feet high 6 feet girth wood yellow or brownish yellow,N/A,N/A,GC,Mix of Handwritten and Typed,no type status,,
Entry 45,0045_V0570543F_collage.png,leg. Schimper,W. P. Schimper,N/A,1467,24.11.63,1863-11-24,N/A,Ipomoea cummunis Chois.,Ipomoea cummunis,N/A,N/A,N/A,Ethiopia,N/A,N/A,N/A,Abyssinia,[precise locality unknown],N/A,N/A,N/A,N/A,Mix of Handwritten and Typed,no type status,,
Entry 46,0046_V0607965F_collage.png,D.W. Thomas & M. Etuge,D. W. Thomas,M. Etuge,6988,18 May 1987,1987-05-18,N/A,Tapura africana Oliv.,Tapura africana,D. W. Thomas,1987,N/A,Cameroon,Southwest,N/A,N/A,Degraded forest at Barombi Kang Kumba,Barombi Kang Kumba,Degraded forest,150 m,04°36'N 09°27'E,NCI Bark 0669/0125-Y | Leaves 0669/0261-W,Typed,no type status,,
Entry 47,0047_V0570471F_collage.png,Edgar A. Mearns,E. A. Mearns,N/A,1114,"September 6 and 7, 1909",1909-09-06,1909-09-07,Evolvulus alsinoides L.,Evolvulus alsinoides,N/A,N/A,N/A,Kenya,N/A,N/A,N/A,"Vicinity of Thika, British East Africa",Vicinity of Thika,N/A,altitude about 1350 meters,N/A,N/A,Typed,no type status,,
Entry 48,0048_V0570108F_collage.png,G. MacNaughton,G. MacNaughton,N/A,580,s.d.,0000-00-00,N/A,Combretum Schumannii Engl.,Combretum schumannii,N/A,N/A,N/A,Kenya,N/A,N/A,N/A,N/A,[precise locality unknown],N/A,N/A,N/A,N/A,Typed,no type status,,
Entry 49,0049_V0570110F_collage.png,J. M. Fay,J. M. Fay,N/A,8271,28 February 1988,1988-02-28,N/A,Combretum smeathmannii G. Don,Combretum,A. Assi,1988,Irvingia smithii | Guiboutia demensii | Berlinia,Cameroon,N/A,N/A,N/A,Along the Sangha River adjacent to the island of Kilona,Along the Sangha River adjacent to the island of Kilona,In riparian forest adjacent to seasonally flooded forest,385 m,02°21'N 16°09'E,NCI# Stem 067E/0466-T | Leaves 067E/0467-U,Typed,no type status,,
Entry 50,0050_V0590787F_collage.png,Coll. D.D. Soejarto,D. D. Soejarto,N/A,4793,"April 1, 1978",1978-04-01,N/A,Diospyros tricolor Hiern.,Diospyros tricolor,N/A,N/A,Thespesia populnea | Sophora occidentalis,Ghana,Greater Accra,N/A,Bortianor,"20 km. West of Accra, Sea coast","20 kilometers West of Accra, Sea coast","Straggling shrub, in association with Thespesia populnea and Sophora occidentalis. Fruits green. Forming clumps just behind beach, on sandy soil. Common.",N/A,N/A,N/A,Typed,no type status,,
Entry 51,0051_V0040586F_collage.png,Narciso Reyna R. 40,N. Reyna,N/A,40,15 diciembre 1967,1967-12-15,N/A,Guatteria scalarinervia D. R. Simpson,Guatteria scalarinervia,unsure and check,N/A,N/A,Peru,Loreto,Maynas,N/A,Santa María - Río Nanay distr. Alto Nanay,Santa María - Río Nanay,"""Carahuasc amarillo"" - arbol bosque húmedo tropical",Alt. 150 m.,N/A,229-I,Typed,Holotype,,
Entry 52,0052_V0081497F_collage.png,M. O. Dillon & D. Dillon,M. O. Dillon,D. Dillon,3776,1 Nov 1983,1983-11-01,N/A,Galvezia fruticosa Gmel.,Galvezia elisensii,M. O. Dillon | Quipuscoa,N/A,N/A,Peru,Arequipa,Caraveli,N/A,Lomas of Atiquipa ca. 10.5 km N of turn-off to Atiquipa KM 584 S of Lima,Lomas of Atiquipa ca. 10.5 kilometers North of turn-off to Atiquipa Kilometer 584 South of Lima,Erect glutinous shrub to 0.75 meters flowers red,ca. 150-200 m,N/A,N/A,Typed,Holotype,,
Entry 53,0053_V0042484F_collage.png,F. W. Sieber,F. W. Sieber,N/A,s.n.,1830,1830-00-00,N/A,Tetrorchidium rubrivenium var. genuinum Müll. Arg.,Tetrorchidium rubrivenium,E. Pax,N/A,N/A,N/A,N/A,N/A,N/A,N/A,[precise locality unknown],N/A,N/A,N/A,60787,Mix of Handwritten and Typed,Isosyntype,,
Entry 54,0054_V0092855F_collage.png,José Campos y O. Díaz 2490,J. Campos,O. Díaz,2490,9 Febrero 1996,1996-02-09,N/A,Amorimia camporum W.R. Anderson,Amorimia camporum,W. R. Anderson,2006,N/A,Peru,Cajamarca,San Ignacio Province,N/A,Distrito Chirinos: Entre La Catagua y Tablón,Entre La Catagua y Tablón,Trepadora; flor amarilla,550 - 650 m,05°19'S 078°47'W,N/A,Typed,Isotype,,
Entry 55,0055_V0078059F_collage.png,Tafalla collected with and for Ruiz & Pavon,N. Tafalla,H. Ruiz | J. Pavon,s.n.,14 November 1784,1784-11-14,N/A,Nolana spathulata Ruiz & Pav.,Nolana spathulata,A. Mesa,1981,N/A,Peru,N/A,N/A,N/A,N/A,[precise locality unknown],N/A,N/A,N/A,N/A,Typed,Isolectotype,,
Entry 56,0056_V0092864F_collage.png,Camilo Diaz y Antonio Peña 8808,C. Diaz,A. Peña,8808,4 Diciembre 1996,1996-12-04,N/A,Symplocos ovata Ståhl,Symplocos ovata,B. Ståhl,2010,N/A,Peru,Amazonas,Luya,N/A,"Camporedondo, Tullanya, Pascana ""Pajaro Tigre""","Camporedondo, Tullanya, Pascana ""Pajaro Tigre""",Liana con frutos verdes. Pedúnculos largos.,2250-2360 m,N/A,N/A,Typed,Isotype,,
Entry 57,0057_V0092900F_collage.png,Ruiz et Pavón,N/A,N/A,9/58,1778-1788,1778-00-00,1788-00-00,Bomarea purpurea (Ruiz & Pavón) Herb.,Bomarea purpurea,N. Hofreiter,2007,N/A,Peru,N/A,N/A,Pillao,N/A,[precise locality unknown],N/A,N/A,N/A,29201,Mix of Handwritten and Typed,isotype,,
Entry 58,0058_V0092906F_collage.png,V. Quipuscoa S. A. Sagástegui A. S. Leiva G. M. Bejarano C.,V. Quipuscoa,S. A. Sagástegui | A. S. Leiva | G. M. Bejarano,1378,20 agosto 1998,1998-08-20,N/A,Lithospermum cinerascens (A. DC.) Johnst.,Lithospermum leymabambense,D. Hensold,1999,N/A,Peru,Amazonas,Chachapoyas,Leymebamba,Carretera a Celendín entre Ishpingo - Pomacocha,Carretera a Celendín between Ishpingo and Pomacocha,Bosque montano fragmentado,2800-3000 m,N/A,N/A,Typed,Isotype,,
Entry 59,0059_V0092915F_collage.png,Coll. Llewelyn Williams,L. Williams,N/A,6999,1/10/30,1930-01-10,N/A,Nectandra cuneata Mez,Nectandra cuneata,D. Giraldo-Cañas,2010,N/A,Peru,San Martin,N/A,San Roque,San Roque,[precise locality unknown],N/A,Alt. 1500-1600 m,N/A,65813,Typed,Holotype,,
Entry 60,0060_V0092918F_collage.png,N/A,N/A,N/A,s.n.,1778-1788,1778-00-00,1788-00-00,Norantea macroscypha Gilg = Marcgraviastrum obovatum (G. Don) Bedell,Marcgraviastrum obovatum,H. G. Bedell,Utrecht VIII 1982,N/A,Peru,N/A,N/A,N/A,N/A,[precise locality unknown],N/A,N/A,N/A,N/A,Mix of Handwritten and Typed,isotype,,
Entry 61,0061_V0092921F_collage.png,N/A,N/A,N/A,s.n.,annis 1788,1788-00-00,N/A,Norantea obovata G. Don = Marcgraviastrum obovatum (G. Don) Bedell,Marcgraviastrum obovatum,H. G. Bedell,VIII 1982,N/A,Peru,N/A,N/A,N/A,N/A,[precise locality unknown],N/A,N/A,N/A,65816,Mix of Handwritten and Typed,Isotype,,
Entry 62,0062_V0190732F_collage.png,Robin B. Foster,R. B. Foster,N/A,8752,13 Sept. 1982,1982-09-13,N/A,Acidoton venezuelanus (Pax. & Hoffm.) Webster,Acidoton venezuelanus,M. J. Huft,1983,N/A,Peru,Huánuco,N/A,N/A,Pachitea; Puerto Inca to Sungaro. Foot trail between Río Pachitea and Río Sungaro.,Puerto Inca to Sungaro. Foot trail between Río Pachitea and Río Sungaro.,Forested low hills and ravines.,Alt. 250-300 m.,"75°00'W, 9°18'S.",N/A,Typed,no type status,,
Entry 63,0063_V0277652F_collage.png,José Schunke Vigo,J. Schunke,N/A,6505,27 May 1961,1961-05-27,N/A,Tontelea attenuata Miers,Tontelea attenuata,J. A. Lombardi,IV 1999 2000,N/A,Peru,San Martín,N/A,N/A,"Quebrada Huicte (rio Huallaga), in tall forest",Quebrada Huicte,In tall forest,529 m alt.,N/A,N/A,Typed,N/A,,
Entry 64,0064_V0152152F_collage.png,Manuel Rimachi Y.,M. Rimachi,N/A,4268,"February 8, 1979",1979-02-08,N/A,Nectandra krukovii (A.C. Smith) Kosterm.,Nectandra krukovii,N/A,N/A,N/A,Peru,Loreto,Requena,Saquena,"Río Ucayali, Quebrada de Aucayacu, above Genaro Herrera","Quebrada de Aucayacu, above Genaro Herrera",marginal forest,8 m,N/A,N/A,Typed,no type status,,
Entry 65,0065_V0277223F_collage.png,N/A,N/A,N/A,95(P1-2),Julio/82,1982-07-00,N/A,Parqueiba sericea Tul.,Parqueiba sericea,T. Plowman,1985,N/A,Peru,Loreto,Maynas,N/A,Ampiyacu-Pevas,Ampiyacu-Pevas,Bosque secundario 35 años,100 m.s.n.m.,N/A,N/A,Typed,no type status,,
Entry 66,0066_V0195906F_collage.png,Percy Núñez & S. Walsh,P. Núñez,S. Walsh,6530,29 October 1986,1986-10-29,N/A,Euphorbia heterophylla L.,Euphorbia heterophylla,M. J. Huft,1987,N/A,Peru,Cuzco,La Convención,Quillabamba,Salaspampa,Salaspampa,Herb 0.6 m; fruits green,Alt. 1110 m.,N/A,N/A,Typed,no type status,,
Entry 67,0067_V0290180F_collage.png,Jose Schunke,J. Schunke,N/A,9560,30 Mayo 1977,1977-05-30,N/A,Hamelia patens Jacq.,Hamelia patens,J. Dwyer,1980,N/A,Peru,San Martin,Lamas,Alonso de Alvarado,San Juan de Pacaiquapa km 72 carretera Tarapoto-Moyobamba,San Juan de Pacaiquapa km 72 carretera Tarapoto-Moyobamba,En bosque secundario con abundante luz solar,Alt. 1000-1050 m.,N/A,N/A,Typed,no type status,,
Entry 68,0068_V0201636F_collage.png,"G. Moore, L. Luna, J. Ruiz",G. Moore,L. Luna | J. Ruiz,138,18-8-81,1981-08-18,N/A,Ficus,Ficus,N/A,N/A,N/A,Peru,Loreto,N/A,N/A,"Quistococha, 14km north of Iquitos","Quistococha, 14 kilometers north of Iquitos","Tree of 20 meters. Important medicinal plant. The ""milk"" from the bark is drunk.",600m elev,N/A,N/A,Typed,no type status,,
Entry 69,0069_V0251887F_collage.png,E. P. Killip A. C. Smith,E. P. Killip,A. C. Smith,26721,"July 20, 21, 1929",1929-07-20,1929-07-21,Psychotria racemosa (Aubl.) Willd.,Psychotria racemosa,N/A,N/A,N/A,Peru,Junín,N/A,N/A,Cahuapanas on Rio Pichis,Cahuapanas on Rio Pichis,dense forest,alt. about 340 meters,N/A,N/A,Mix of Handwritten and Typed,no type status,,
Entry 70,0070_V0243915F_collage.png,M. O. Dillon and I. Sánchez V.,M. O. Dillon,I. Sánchez V.,6310,22 Jul 1991,1991-07-22,N/A,Wissadula grandifolia Baker & Rusby,Wissadula grandifolia,P. Fryxell,1993,N/A,Peru,Piura,Huancabamba,N/A,ca. 2 km N of Canchaque,2 kilometers north of Canchaque,Shrubs to 1 meter flowers yellow,ca. 1450 m alt.,[5°24'S; 79°36'W],N/A,Typed,no type status,,
Entry 71,0071_V0187051F_collage.png,COLL. J. FRANCIS MACBRIDE,J. F. Macbride,N/A,4806,"JUNE 23, 1923",1923-06-23,N/A,Croton ballivianus,Croton ballivianus,N/A,N/A,N/A,Peru,N/A,N/A,N/A,CUEVA GRANDE ESTACION NEAR POZUZO,Cueva Grande Estacion near Pozuzo,Sunny brushy slope. Open brushy 4-5 ft. shrub,ABOUT 3500 FEET,N/A,N/A,Typed,no type status,,
Entry 72,0072_V0258426F_collage.png,A. Sagastegui A.,A. Sagastegui,N/A,3920,18 Julio 1962,1962-07-18,N/A,Geranium chilloense Kunth,Geranium chilloense,C. Aedo,2007,N/A,Peru,Cajamarca,Contumaza,N/A,Ladera calcita,[precise locality unknown],N/A,2920 m s.n.m.,N/A,3820,Mix of Handwritten and Typed,no type status,,
Entry 73,0073_V0193750F_collage.png,J. Mostacero L. | S. Leiva G. | F. Mejia C. | F. Pelaez | J. Guevara B.,J. Mostacero,S. Leiva G. | F. Mejia C. | F. Pelaez | J. Guevara B.,1640,14-X-1986,1986-10-14,N/A,Dalechampia aristolochiifolia Kuth,Dalechampia aristolochiifolia,M. J. Huft,1992,N/A,Peru,Cajamarca,Cutervo,N/A,La Pucarilla (Socota-San Andres),La Pucarilla,Laderas al borde de carretera,2450 m.s.n.m,N/A,DUPLICADOS F.240,Mix of Handwritten and Typed,no type status,,
Entry 74,0074_V0228073F_collage.png,"Leg. Spichiger, R. & P.-A. Loizeau",R. Spichiger,P.-A. Loizeau,3012,10-4-86,1986-04-10,N/A,Pourouma guianensis ssp guianensis,Pourouma guianensis,unsure and check,N/A,N/A,Peru,Loreto,N/A,N/A,Arboretum arbre 5/452,Arboretum arbre 5/452,"Bosque de terraza alta, suelo arenoso",Alt. 125 m,73°45'W-4°55'S,N/A,Mix of Handwritten and Typed,no type status,,
Entry 75,0075_V0100062F_collage.png,G. Klug,G. Klug,N/A,660,Dec. 1929,1929-12-00,N/A,Balsesia floribunda Benth. det. J. F. Macbride,Balsesia floribunda,J. F. Macbride,N/A,N/A,Peru,Loreto,N/A,N/A,Mishuyacu near Iquitos,Mishuyacu near Iquitos,forest,alt. 100 meters,N/A,N/A,Typed,no type status,,
Entry 76,0076_V0198402F_collage.png,coll. T. R. Dudley,T. R. Dudley,N/A,12063,24 Aug. 1968,1968-08-24,N/A,Dendrophthora mesembryanthemifolia Ule,Dendrophthora sp.,J. Kuijt,18 Dec. 1984,N/A,Peru,Ayacucho,La Mar,N/A,"eastern Massif of the Cordillera Central opposing the Cordillera Vilcabamba between Tambo San Miguel, Ayna and the Hacienda Luisiana","eastern Massif of the Cordillera Central opposing the Cordillera Vilcabamba between Tambo San Miguel, Ayna and the Hacienda Luisiana","Parasitic, foliage yellowish-green, calyx bright orange, translucent pink, waxy in dense areas isolated, 40-50 feet high, in hepatic forest at timberline",c. 3220 meters,c. 73°53'W 12°45'S,N/A,Typed,no type status,,
Entry 77,0077_V0225274F_collage.png,G. Klug,G. Klug,N/A,1595,April 11 1931,1931-04-11,N/A,Ficus Llewelynii Standl,Ficus trigona,M. Vásquez Avila,Utrecht 1983,N/A,Peru,Loreto,N/A,N/A,Mishuyacu near Iquitos,Mishuyacu near Iquitos,forest,alt. 100 meters,N/A,N/A,Mix of Handwritten and Typed,no type status,,
Entry 78,0078_V0224820F_collage.png,Mildred E. Mathias Dermot Taylor,M. E. Mathias,D. Taylor,5576,10 July 1961,1961-07-10,N/A,Malpighiaceae But I cannot name it sterile not even to genus,Malpighiaceae,W. R. Anderson,1983,N/A,Peru,Loreto,N/A,N/A,vicinity of Requena,vicinity of Requena,"Liana 2-3 inches in diameter ""Barbasco silvestre""",N/A,N/A,N/A,Typed,no type status,,
Entry 79,0079_V0304780F_collage.png,José Schunke Vigo,J. Schunke,N/A,6677,17 Dec 1964,1964-12-17,N/A,Paullinia imberbis Radlk.,Paullinia bracteosa,D. R. Simpson,Apr. 1973,N/A,Peru,Loreto,N/A,N/A,Quebrada de Maquia (Contamana),Quebrada de Maquia,tall forest,220 m alt.,N/A,N/A,Typed,no type status,,
Entry 80,0080_V0238260F_collage.png,COLL. LLEWELYN WILLIAMS,L. Williams,N/A,3363,"SEPT.-OCT., 1929",1929-09-00,1929-10-00,Psychotria viridis R & P,Psychotria viridis,N/A,N/A,N/A,Peru,Loreto,N/A,N/A,Alto Rio Itaya,Alto Rio Itaya,Forest of Pauris,Alt. 145 m.,N/A,270,Mix of Handwritten and Typed,no type status,,
Entry 81,0081_V0225047F_collage.png,"Coll. T. Plowman, A. Sagástegui A., J. Mostacero L., F. R. Mejía & F. Peláez",T. Plowman,A. Sagástegui A. | J. Mostacero L. | F. R. Mejía | F. Peláez,14242,12 July 1986,1986-07-12,N/A,Abutilon mollissimum (Cav.) Sweet,Abutilon mollissimum,P. Fryxell,1987,N/A,Peru,Cajamarca,Jaén,N/A,"Road from Pucará to Chamaya, km. 21 east of Pucará, along Río Huancabamba","Road from Pucará to Chamaya, 21 kilometers east of Pucará, along Río Huancabamba",Dry scrub forest on steep slopes,Alt. 700 m,N/A,No. 14242,Typed,no type status,,
Entry 82,0082_V0239614F_collage.png,Magda Chanco with Michelle McMahon and Larry Hufford,M. Chanco,M. McMahon | L. Hufford,s.n.,14 April 2003,2003-04-14,N/A,Abutilon sp.,Abutilon sp.,N/A,N/A,N/A,Peru,Cajamarca,N/A,N/A,Chilete-San Pablo road about 15 km from Chilete,Chilete-San Pablo road about 15 kilometers from Chilete,N/A,3614 feet elevation,S7° 10.554' W78° 49.665',N/A,Typed,no type status,,
Entry 83,0083_V0414961F_collage.png,"Marcos Ríos 4399 Tony Mori, Nigel Pitman, Luis Torres, Corine Vriesendorp",M. Ríos,T. Mori | N. Pitman | L. Torres | C. Vriesendorp,4399,13 octubre 2014,2014-10-13,N/A,Andira macrothyrsa Ducke,Andira macrothyrsa,N/A,N/A,N/A,Peru,Loreto,Requena,N/A,"Prov. Requena, Dtto. de Soplin. Quebrada Yanayacu-Rio Blanco. Campamento Wiswincho del inventario rapido #27, de la region Tapiche-Blanco","Quebrada Yanayacu-Rio Blanco, Campamento Wiswincho del inventario rapido number 27, de la region Tapiche-Blanco","Bosque de Planicie Inundable de aguas blancas. Arbol 7 m, flores amarillas y los botones son de color beige (beige)",Alt. 90-110 msnm,"05°48'33.5""S 73°51'53.8""W",N/A,Typed,no type status,,
Entry 84,0084_V0414962F_collage.png,Marcos Ríos Tony Mori Nigel Pitman Luis Torres Corine Vriesendorp,M. Ríos,T. Mori | N. Pitman | L. Torres | C. Vriesendorp,4399,13 octubre 2014,2014-10-13,N/A,Andira macrothyrsa Ducke,Andira macrothyrsa,N/A,N/A,N/A,Peru,Loreto,Requena,N/A,Quebrada Yanayacu-Río Blanco Campamento Wiswincho del inventario rápido #27 de la región Tapiche-Blanco,Quebrada Yanayacu-Río Blanco Campamento Wiswincho del inventario rápido #27 de la región Tapiche-Blanco,Bosque de Planicie Inundable de aguas blancas Árbol 7 m flores amarillas y los botones son de color beige (beige),90-110 msnm,"05°48'33.5""S 73°51'53.3""W",N/A,Typed,no type status,,
Entry 85,0085_V0462893F_collage.png,Ynes Mexia,Y. Mexia,N/A,8265,"Oct. 9, 1936",1936-10-09,N/A,Piper callosum Ruiz & Pavon,Piper callosum,W. Trelease,N/A,N/A,Peru,Huanuco,N/A,N/A,Near confluence Rio Cayumba with Huallaga,Near confluence Rio Cayumba with Huallaga,Forested slope above road,Alt. 805 m,N/A,N/A,Typed,no type status,,
Entry 86,0086_V0462895F_collage.png,Ynes Mexia,Y. Mexia,N/A,6157,"Nov. 24, 1931",1931-11-24,N/A,Piper callosum Ruiz & Pav.,Piper callosum,W. Trelease,N/A,N/A,Peru,Loreto,N/A,N/A,Above Pongo de Manseriche Right bank of mouth of Rio Santiago,Above Pongo de Manseriche Right bank of mouth of Rio Santiago,Dense forest,Alt. 200 m.,N/A,N/A,Typed,No type status,,
Entry 87,0087_V0441679F_collage.png,Coll. Donald R. Simpson & José Schunke V.,D. R. Simpson,J. Schunke V.,565,"January 4, 1968",1968-01-04,N/A,Ipomoea carnea Jacq.,Ipomoea carnea,D. Simpson,Jan. 1969,N/A,Peru,Tumbes,Tumbes,Pampas de Hospital,Along the road about 10 km. northwest of El Caucho,Along the road about 10 kilometers northwest of El Caucho,"Vine clambering over shrubs; corolla pale lavender, open in the morning sun, closed on this cloudy afternoon when collected. Common from the dry, deciduous forest zone, downward into the very dry thorn-scrub.",N/A,N/A,N/A,Typed,no type status,,
Entry 88,0088_V0441677F_collage.png,Coll. T. Plowman & P. M. Rury,T. Plowman,P. M. Rury,11105,6 December 1981,1981-12-06,N/A,Ipomoea carnea Jacq.,Ipomoea carnea,P. MacDonald,1983,N/A,Peru,Huánuco,Huánuco,N/A,8 km. northeast of Huánuco on road to Tingo María,8 kilometers northeast of Huánuco on road to Tingo María,Scandent shrub on roadside near houses. Stem with milky sap. Fls. pink.,Alt. 1750 m.,"Approx. 9°52'S., 76°11'W.",N/A,Typed,no type status,,
Entry 89,0089_V0401892F_collage.png,Robin B. Foster,R. B. Foster,N/A,4240,"Aug. 19, 1978",1978-08-19,N/A,Aechmea,Aechmea corymbosa,E. J. Gouda,2018-02-05,N/A,Peru,Loreto,Maynas,N/A,Rio Nanay Caseria Mishana 30km SW of Iquitos,Callicebus Biological Res 4km S of Mishana,Terrestrial in white sand scrub bracts bright red-pink flowers white Forested hills on white or brown sand soils,N/A,N/A,N/A,Typed,no type status,,
Entry 90,0090_V0460617F_collage.png,"J. Farfán, L. Valenzuela, I. Huamantup a, A. Carazas, W. Argandoña 1262",J. Farfán,L. Valenzuela | I. Huamantup a | A. Carazas | W. Argandoña,1262,23 Octubre 2006,2006-10-23,N/A,Anthurium clavigerum Poepp.,Anthurium clavigerum,T. B. Croat,2008,N/A,Peru,Cusco,La Convención,N/A,"Dist. Vilcabamba, Chuaniquiri camino a Riobamba, Bosque secundario",Chuaniquiri camino a Riobamba,"Bosque Secundario. Epífita, hasta 70 cm, espádice rojo, espata verde.",1009 m,"12°47'15""S 073°10'10""W",N/A,Typed,no type status,,
Entry 91,0091_V0469643F_collage.png,Thomas B. Croat,T. B. Croat,N/A,18210,"July 18, 1972",1972-07-18,N/A,Agave americana L.,Agave americana,N/A,N/A,N/A,Peru,Loreto,N/A,N/A,Sandy area 12.5 km. SW of Iquitos on road to Lago Quisto-cocha,Sandy area 12.5 kilometers southwest of Iquitos on road to Lago Quisto-cocha,Sandy area,N/A,N/A,N/A,Typed,no type status,,
Entry 92,0092_V0075820F_collage.png,coll. T. R. Dudley,T. R. Dudley,N/A,10783,4 July 1968,1968-07-04,N/A,Thelypteris dudleyi A. R. Smith,Thelypteris dudleyi,A. R. Smith,Date 1989,N/A,Peru,Cuzco,La Convencion,N/A,between camp 4&5; almost to Camp 5,between camp 4 and 5 almost to Camp 5,Common terrestrial type with bright green foliage and purplish-black and glossy petioles saxatile on almost vertical rock faces in full sun on old open landslide just above the cloud forest at c. 2825 m one of the commonest colonizers of landslide,c. 2825 m,12° 37'; 73° 32',65658,Typed,Isotype,,
Entry 93,0093_V0075836F_collage.png,S. Knapp,S. Knapp,N/A,5881,4 July 1982,1982-07-04,N/A,TRICHIPTERIS PINNATA Stolze,Trichipteris pinnata,Robert G. Stolze,1984,N/A,Panama,Colón,N/A,N/A,"Santa Rita Ridge road, 21-26 km from Transisthmian Highway","Santa Rita Ridge road, 21-26 kilometers from Transisthmian Highway",Tropical wet forest,500-550 m,"9°25'N, 79°37'W",1932768,Typed,Isotype,,
Entry 94,0094_C0616676F_collage.png,COL. J. DORANTES,J. Dorantes,N/A,455,01/01/1972,1972-01-01,N/A,Woodwardia spinulosa Mart. & Gal.,Woodwardia spinulosa,M. Palacios-Rios,"September, 2000",N/A,Mexico,Veracruz,Jalapa,N/A,Lito del Gato,Lito del Gato,Bosque caducifolio suelo rojo arcilloso muy abundante helecho perenne veg. riparia,TAM: 1.30 M.,MAPA 38.5 29.0,P005051,Typed,no type status,,
Entry 95,0095_C0644079F_collage.png,"A. Monteagudo, C. Mateo, G. Ortiz",A. Monteagudo,C. Mateo | G. Ortiz,4909,10 Abril 2003,2003-04-10,N/A,Blechnum occidentalis L.,Blechnum occidentalis,H. van der Werff,2005,N/A,Peru,Pasco,Oxapampa,N/A,Distrito Pozuzo Parque Nacional Yanachaga Chemillen Pozuzo Sector Pan de Azúcar Zona de Recuperación,Parque Nacional Yanachaga Chemillen Pozuzo Sector Pan de Azúcar Zona de Recuperación,Bosque ribereño,1100-1250m,10°15'S 75°13'W,N/A,Typed,no type status,,
Entry 96,0096_C0658238F_collage.png,Ynes Mexia,Y. Mexia,N/A,8066,"May 14, 1936",1936-05-14,N/A,Adiantum pulverulentum L.,Adiantum pulverulentum,Copeland,N/A,N/A,Peru,Cuzco,La Convencion,N/A,upper valley of Rio Sambray western affluent of Vilcanota along stream in virgin forest,upper valley of Rio Sambray western affluent of Vilcanota along stream in virgin forest,"Common scattered ""Raqui-raqui""",Alt. about 1800 m.,N/A,N/A,Typed,no type status,,
Entry 97,0097_C0637474F_collage.png,J.I. Calzada,J. I. Calzada,N/A,5759,11-enero-1980,1980-01-11,N/A,Diplazium francois Liebm.,Diplazium francois,R. G. Stolze,1983,Liquidambar styraciflua | Quercus | Alnus,Mexico,Veracruz,Xico,N/A,Ranchería de Coatititlán,Ranchería de Coatititlán,Bosque Caducifolio Muy húmedo,1820 m s n m,19° 29' N 97° 04' W,N/A,Typed,no type status,,
Entry 98,0098_C0636906F_collage.png,Antonio Molina R.,A. Molina,N/A,1427,"Nov. 4, 1948",1948-11-04,N/A,Thelypteris piloso-hispida (Hook) Morton,Thelypteris rudis,A. R. Smith,1974,N/A,Honduras,Francisco Morazán,N/A,N/A,Helecho arboreo Bosque lluvioso norte de la Mt Uyuca caminos Tatumbla Lebranza y Quebrada El Trandillo sobre la Mt Uyuca,North of the Mount Uyuca roads Tatumbla Lebranza and Quebrada El Trandillo on the Mount Uyuca,Bosque lluvioso,Alt 1800 m,at about Longitude 87 W and Latitude 14 N,N/A,Typed,no type status,,
Entry 99,0099_C0665739F_collage.png,B. León & N. Huapaya,B. León,N. Huapaya,2911,10 setiembre 1991,1991-09-10,N/A,Thelypteris aucholora (Sod.) Reed,Thelypteris aucholora,R. G. Stolze,1992,N/A,Peru,Cuzco,Paucartambo,N/A,"Bosque de Nubes, Río La Unión. En ladera.","Bosque de Nubes, Río La Unión","Hierba, rizoma masivo rastrero, hojas 1.5 m largo, pinnas reducidas base nectarios presentes",1700-1800 m,N/A,N/A,Typed,no type status,,
Entry 100,0100_C0626158F_collage.png,"Louis O. Williams, Antonio Molina R., Terua P. Williams, Dorothy N. Gibson, and Chester Laskowski",L. O. Williams,A. Molina R. | T. P. Williams | D. N. Gibson | C. Laskowski,27621,"January 15, 1965",1965-01-15,N/A,Polypodium blepharodes Maxon,Grammitis blepharodes,R. Stolze,1965,N/A,Nicaragua,Matagalpa,N/A,N/A,"Montane rain forest, or cloud forest, Disparate de Potter, Sta. María de Ostuma, Cordillera Central de Nicaragua","Disparate de Potter, Santa María de Ostuma, Cordillera Central de Nicaragua",Epiphyte on mossy tree,alt. 1600 m,N/A,N/A,Typed,no type status,,
Entry 101,0101_C0665657F_collage.png,Ken Young & Mark Eisenberg 265,K. Young,M. Eisenberg,265,20 April 1981,1981-04-20,N/A,Thelypteris (subg. Amauropelta) cheilanthoides (Kunze) Proctor,Thelypteris cheilanthoides,A. R. Smith,1989,N/A,Peru,Cuzco,La Convencion,N/A,"Just east of Quillabamba. Finca Chichima; cocoa, coffee, yuca, mangoes, bananas, corn crops grown.",Just east of Quillabamba. Finca Chichima,"Cocoa, coffee, yuca, mangoes, bananas, corn crops grown. Fern. Terrestrial; 1 m tall.",Alt. 1300-1400 m.,N/A,N/A,Typed,no type status,,
Entry 102,0102_C0045536F_collage.png,Thomas G. Lammers,T. G. Lammers,N/A,10674,9 May 1998,1998-05-09,N/A,Dryopteris carthusiana (Vill.) H.P. Fuchs,Dryopteris carthusiana,N/A,N/A,N/A,United States,Illinois,Cook,N/A,"Palos Twp. Swallow Cliffs Woods Forest Preserve, southwest of the jct. of US Hwy 45 and State Hwy 83","Swallow Cliffs Woods Forest Preserve, southwest of the junction of US Highway 45 and State Highway 83",Local in mesic maple-basswood forest on steep slopes of deep ravine south of toboggan run,N/A,N/A,N/A,Typed,no type status,,
Entry 103,0103_C0627900F_collage.png,Louis O. Williams | Antonio Molina R. | Albertina R. Molina,L. O. Williams,A. Molina R. | A. R. Molina,12562,"Mayo 22, 1963",1963-05-22,N/A,Polypodium montigenum Maxon,Polypodium montigenum,A. Molina,N/A,N/A,El Salvador,Santa Ana,N/A,N/A,Bosque abierto de Montaña Montecristo,Montecristo,Epífita. Bosque abierto de Montaña,Alt. 2000 m,N/A,N/A,Typed,no type status,,
Entry 104,0104_V0082645F_collage.png,M. O. Dillon,M. O. Dillon,N/A,5376,21 Dec 1987,1987-12-21,N/A,Notholaena mollis Kunze,Notholaena mollis,unsure and check,N/A,Cheilanthes mollis | Gomphrena decumbens,Chile,Antofagasta,Antofagasta,N/A,Cerro Perales ca. 5 km E of Taltal,Cerro Perales approximately 5 kilometers east of Taltal,Terrestrial growing in rock crevices,600-850 m,25° 25' S 70° 25' W,N/A,Typed,no type status,,
Entry 105,0105_C0666362F_collage.png,Rolla M. & Alice F. Tryon,R. M. Tryon,A. F. Tryon,6566,23 October 1963,1963-10-23,N/A,Thelypteris lindigii (C.Chr.) Alston,Thelypteris rufa,A. R. Smith,"1979, 1989",N/A,Peru,Ancash,N/A,N/A,"Road from Huaras to Cusma, west valley","Road from Huaras to Cusma, west valley",damp shaded rocks,2800 m.,N/A,N/A,Typed,no type status,,
Entry 106,0106_C0666207F_collage.png,E. P. Killip | A. C. Smith,E. P. Killip,A. C. Smith,2974,"September 22-29, 1929",1929-09-22,1929-09-29,Dryopteris megalodus (Schk.) Urban,Thelypteris pennata,A. R. Smith,1989,N/A,Peru,Loreto,N/A,N/A,"Soledad, on Rio Itaya","Soledad, on Rio Itaya",Dense forest,alt. about 110 meters,N/A,N/A,Typed,no type status,,
Entry 107,0107_C0666206F_collage.png,F. P. Killip | A. C. Smith,F. P. Killip,A. C. Smith,24937,"September 18, 1929",1929-09-18,N/A,Dryopteris megalodus (Schk.) Urban,Thelypteris pennata,A. R. Smith,Date 1989,N/A,Peru,Loreto,N/A,San Antonio,on Rio Itaya,on Rio Itaya,dense forest,alt. about 110 meters,N/A,N/A,Mix of Handwritten and Typed,no type status,,
Entry 108,0108_C0666203F_collage.png,Coll. Macbride & Featherstone,J. F. Macbride,N. Featherstone,1622,"JULY 8-22, 1922",1922-07-08,1922-07-22,Dryopteris pavoniana (Kze) C Chr,Dryopteris pavoniana,A. R. Smith,1979,N/A,Peru,N/A,N/A,Mito,Sunny dirt ledges of the grass shrub formation,[precise locality unknown],Sunny dirt ledges of the grass shrub formation,About 9000 ft,N/A,N/A,Typed,no type status,,
Entry 109,0109_C0666202F_collage.png,J. J. Wurdack No. 705,J. J. Wurdack,N/A,705,1 June 1962,1962-06-01,N/A,Thelypteris (Thelypteris) pavoniana (Klotzsch),Thelypteris pavoniana,D. B. Lellinger | A. R. Smith,"1966 | 1979, 1989",N/A,Peru,Amazonas,Chachapoyas,N/A,Upper slopes of Puma-urcu east-southeast of Chachapoyas,Upper slopes of Puma-urcu east-southeast of Chachapoyas,"On banks, locally frequent",elev. 2700-3000 m,N/A,N/A,Typed,no type status,,
Entry 110,0110_C0666112F_collage.png,ROLLA M. TRYON & ALICE F. TRYON,R. M. Tryon,A. F. Tryon,5202,"Aug. 13, 1956",1956-08-13,N/A,Thelypteris opulenta,Thelypteris opulenta,A. R. Smith,1979,N/A,Peru,Loreto,Maynas,N/A,"Rio Itaya, 10 km. s. of Iquitos","Rio Itaya, 10 kilometers south of Iquitos","In old banana planting. Fertile leaf, sterile pinnae, fertile pinnae.",N/A,N/A,N/A,Typed,no type status,,
Entry 111,0111_C0639123F_collage.png,"Louis O. Williams, Antonio Molina R. and Terua P. Williams",L. O. Williams,A. Molina R. | T. P. Williams,23634,"January 8-15, 1963",1963-01-08,1963-01-15,Lycopodium clavatum L.,Lycopodium clavatum,C. V. Morton | D. B. Lellinger,1964,N/A,Nicaragua,Matagalpa,N/A,N/A,"Cloud forest area, Sta. María de Ostuma, Cordillera Central de Nicaragua between Matagalpa and Jinotega, Department of Matagalpa","Sta. María de Ostuma, Cordillera Central de Nicaragua between Matagalpa and Jinotega",Terrestrial on open bank,alt. 1300-1500 meters,N/A,N/A,Typed,no type status,,
Entry 112,0112_C0675553F_collage.png,John T. Atwood Jr.,J. T. Atwood,N/A,77105,8 Feb. 1977,1977-02-08,N/A,Adiantum trapeziforme L.,Adiantum eximium,M. R. McCarthy,2012,N/A,Nicaragua,Granada,N/A,N/A,Volcan Mombacho Lower cloud forest near finca Cutirre,Volcan Mombacho near finca Cutirre,Lower cloud forest,N/A,N/A,N/A,Typed,no type status,,
Entry 113,0113_C0675619F_collage.png,H. et al.,H.,N/A,7644,4-21-35,1935-04-21,N/A,Adiantum trapeziforme L.,Adiantum exuberans,M. R. McCarthy,2012,N/A,Mexico,Mexico,N/A,Pantoja,Pantoja,[precise locality unknown],dry barranca,N/A,N/A,N/A,Typed,no type status,,
Entry 114,0114_C0355438F_collage.png,Leg. R. A. Maas Geesteranus,R. A. Maas Geesteranus,N/A,5744,12-VIII-1949,1949-08-12,N/A,Asplenium dregeanum Kze.,Asplenium sandersonii,R. Faden,1976,Conopharyngia holstii,Kenya,Nyanza,Kericho,N/A,South Western Mau Forest Reserve camp 8,South Western Mau Forest Reserve camp 8,riparian-woodland along the river Itare,1920 m s.m.,"lat. 0°36'30"" S. longe. 35°12'20"" E.",N/A,Typed,no type status,,
Entry 115,0115_C0359489F_collage.png,"M. Véliz con J. M. Véliz, J. Charco, H. Sainz, J. Lopez y R. Esteban",M. Véliz,J. M. Véliz | J. Charco | H. Sainz | J. Lopez | R. Esteban,16199,24/XI/2005,2005-11-24,N/A,Lophosoria quadripinnata (J.F. Gmel) C. Chr. var quadripinnata,Lophosoria quadripinnata,M. Véliz,24/XI/2005,Quercus sp.,Guatemala,Jalapa,N/A,N/A,"Aldea San Raymundo, río Manzanillos","Aldea San Raymundo, río Manzanillos","Helecho muy frecuente, con frondes compuestos, glaucos en el envés, creciendo dentro de bosque de Quercus sp.",2308 msnm,"14° 33' 43.7'' N, 90° 06' 19.7'' O",F04/2005,Typed,no type status,,
Entry 116,0116_C0662895F_collage.png,Chas. F. Millspaugh,C. F. Millspaugh,N/A,893,Jan. 28-Feb. 6,1899-01-28,1899-02-06,Asplenium dentatum L.,Asplenium dentatum,N/A,N/A,N/A,Jamaica,N/A,N/A,N/A,Port Antonio,Port Antonio,N/A,N/A,N/A,N/A,Typed,no type status,,
Entry 117,0117_C0363828F_collage.png,Collector: T. G. Yuncker,T. G. Yuncker,N/A,17429,"Nov. 17, 1957",1957-11-17,N/A,Lycopodium cernuum L.,Lycopodium cernuum,N/A,N/A,N/A,Jamaica,St. Andrew,N/A,N/A,along trail near Bellevue,along trail near Bellevue,Scrambling over side of cut,Alt. 3000-4000 ft.,N/A,N/A,Typed,no type status,,
Entry 118,0118_C0363985F_collage.png,Carvalho,N. Carvalho,N/A,2092,25-VII-1986,1986-07-25,N/A,Lycopodiella cernua (L.) Pic.-Serm.,Lycopodiella cernua,J. Fernández Casas,1991,N/A,Equatorial Guinea,Bioco,N/A,N/A,"Malabo - Basilé, km 13, cerca de Basilé, 32NMK7808, 390 m, márgenes de la carretera","Malabo - Basile, kilometer 13, near Basile, margins of the road",Postrada. Forma pequeñas colonias dispersas.,390 m,32NMK7808,N/A,Typed,no type status,,
Entry 119,0119_C0363442F_collage.png,Henk van der Werff 11699,H. van der Werff,N/A,11699,12 June 1990,1990-06-12,N/A,Diplazium assimile (Endl.) Bedd.,Diplazium assimile,H. van der Werff,1991,N/A,Australia,Queensland,N/A,N/A,Boonjee logging area at base of Mt. Bartle Frere,Boonjee logging area at base of Mount Bartle Frere,Rainforest,N/A,145°43'E 17°25'S,N/A,Typed,no type status,,
Entry 120,0120_C0378283F_collage.png,M. Tagawa & K. Iwatsuki,M. Tagawa,K. Iwatsuki,1150,"July 28, 1956",1956-07-28,N/A,Diplazium amabile (Tag.) Tag.,Diplazium amabile,N/A,N/A,N/A,Japan,Kagoshima,N/A,N/A,"Loc. Kyushu. Pref. Kagoshima: western slope of Mt. Hoyoshi, south of Kanoya City.","Western slope of Mount Hoyoshi, south of Kanoya City",Wet rocky slope in densely wooded ravine,N/A,N/A,N/A,Typed,no type status,,
Entry 121,0121_C0364726F_collage.png,W. Takeuchi & J. Wiakabu,W. Takeuchi,J. Wiakabu,9366,"February 5, 1994",1994-02-05,N/A,Blechnum ledermannii Brause,Blechnum ledermannii,N/A,N/A,N/A,Papua New Guinea,New Ireland,N/A,N/A,Hans Meyer Range Site 4 on the expedition report,Hans Meyer Range Site 4 on the expedition report,Pristine subcloud forest dominated by bryophytic and fern growth,c. 1800 m,4°25' S X 152°59' E,OFCZ0683-A,Typed,no type status,,
Entry 122,0122_C0366013F_collage.png,Tagawa & Iwatsuki,M. Tagawa,K. Iwatsuki,888,"May 20, 1956",1956-05-20,N/A,Dryopteris crassirhizoma Nakai,Dryopteris crassirhizoma,N/A,N/A,N/A,Japan,N/A,N/A,N/A,N/A,[precise locality unknown],N/A,N/A,N/A,N/A,Typed,no type status,,
Entry 123,0123_C0366453F_collage.png,Coll. J. Ohwi,J. Ohwi,N/A,s.n.,April 1951,1951-04-00,N/A,Polystichum tripteron Presl,Polystichum tripteron,N/A,N/A,N/A,Japan,Honshu,N/A,N/A,Jizmuji in Sagami,Jizmuji in Sagami,N/A,N/A,N/A,NSM. No. 202,Typed,no type status,,
Entry 124,0124_C0364207F_collage.png,,,,,,,,,,,,,,,,,,,,,,,,,,
Entry 125,0125_C0376117F_collage.png,R.B. & A.J. Faden,R. B. Faden,A. J. Faden,77/53,5 Jan. 1977,1977-01-05,N/A,Pyrossia lanceolata (L.) Farw.,Pyrossia lanceolata,D. B. Lellinger,1979,N/A,Sri Lanka,North Western Province,Kurunegala,N/A,Doluwa kanda Hill,Doluwa kanda Hill,Forest. Locally common.,Alt. 600 m,"7°37'N, 80°24'30""E",N/A,Typed,no type status,,
Entry 126,0126_C0377881F_collage.png,By Albert N. Steward C. Y. Chiao and H. C. Cheo,A. N. Steward,C. Y. Chiao | H. C. Cheo,344,Sept. 4 1931,1931-09-04,N/A,Dryopteris bosquieri Christ,Dryopteris bosquieri,N/A,N/A,N/A,China,Guizhou,N/A,N/A,Ta Ho Yen Fan Ching Shan,Ta Ho Yen Fan Ching Shan,Moist brushy slope soil black,alt. 980 m,N/A,N/A,Typed,no type status,,
Entry 127,0127_C0382365F_collage.png,Julie F. Barcelona,J. F. Barcelona,N/A,48,Nov. 1989,1989-11-00,N/A,Selaginella cf. repanda,Selaginella philippina,J. F. Barcelona,Nov. 1989,N/A,Philippines,Antique,N/A,Sibalom,W. Visayas Panay I. Antique Prov. Sibalom,[precise locality unknown],Egata on shaded and moist areas,N/A,N/A,190235 | 190135,Mix of Handwritten and Typed,no type status,,
Entry 128,0128_C0368029F_collage.png,Col. L. & A. Fay,L. Fay,A. Fay,1206,11 Apr 1985,1985-04-11,N/A,Drynaria laurentii (Christ.) Hieron.,Drynaria laurentii,N/A,N/A,N/A,Liberia,N/A,N/A,N/A,Cuttington University College,Cuttington University College,On tree trunk about 10 feet from ground common in groves of rubber trees on trunks,Alt. 250 m.,N/A,N/A,Typed,no type status,,
Entry 129,0129_C0356535F_collage.png,Coll. H. St. John,H. St. John,N/A,16662,"Aug. 26, 1934",1934-08-26,N/A,Humata banksii Alston,Humata banksii,E. B. Copeland,N/A,N/A,France,French Polynesia,N/A,N/A,Northwest slope of Teape Teti woods,Northwest slope of Teape,on mossy tree limb,350 meters,N/A,N/A,Typed,no type status,,
Entry 130,0130_C0383576F_collage.png,T. G. Yuncker,T. G. Yuncker,N/A,18561,"Mar. 30, 1958",1958-03-30,N/A,Selaginella plana (Diev.) Hieron.,Selaginella plana,N/A,N/A,N/A,Jamaica,Portland,N/A,N/A,"On wet embankment along trail, rain forest, John Crow Mts., 1.5-2 miles southwest of Ecclesdown","John Crow Mountains, 1.5 to 2 miles southwest of Ecclesdown","On wet embankment along trail, rain forest",Alt. 1500-2500 ft.,N/A,N/A,Typed,no type status,,
Entry 131,0131_C0383180F_collage.png,A. Carestia,A. Carestia,N/A,851,1871,1871-00-00,N/A,Lycopodium complanatum L.,Lycopodium complanatum,J. H. Wilce,1962,Lycopodium chamaecyparissus,Italy,Piedmont,Valsesia,Scopello,Salita alla Boscarola presso Scopello in Valsesia,Salita alla Boscarola presso Scopello,N/A,N/A,N/A,N/A,Typed,no type status,,
Entry 132,0132_C0358423F_collage.png,coll. C. J. Chamberlain,C. J. Chamberlain,N/A,s.n.,"Oct. 15, 1911",1911-10-15,N/A,Trichomanes reniforme,Trichomanes reniforme,N/A,N/A,N/A,New Zealand,N/A,N/A,Ohakune,Ohakune,[precise locality unknown],N/A,N/A,N/A,N/A,Typed,no type status,,
Entry 133,0133_C0662992F_collage.png,R. L. Wilbur no. 8185 E. L. Dunn H. A. Hespenheide D. R. Wiseman,R. L. Wilbur,E. L. Dunn | H. A. Hespenheide | D. R. Wiseman,8185,2 August 1964,1964-08-02,N/A,Cnemidaria grandifolia (Willd.) Proctor var. grandifolia,Cnemidaria grandifolia,R. G. Stolze,1971,N/A,Dominica,Saint Paul,N/A,N/A,Disturbed rainforest in the upper Layou Valley about 5 miles from Clarke Hall towards Pont Cassé,Upper Layou Valley about 5 miles from Clarke Hall towards Pont Cassé,Disturbed rainforest,N/A,N/A,N/A,Typed,no type status,,
Entry 134,0134_C0377971F_collage.png,R.B. & A.J. Faden,R. B. Faden,A. J. Faden,77/31,2 Jan 1977,1977-01-02,N/A,Thelypteris,Thelypteris,N/A,N/A,N/A,Sri Lanka,Central,Nuwara Eliya,N/A,between mile posts 46/3 and 46/4 on Nuwara Eliya-Kandy road,between mile posts 46/3 and 46/4 on Nuwara Eliya-Kandy road,Shady moist bank near stream Local and uncommon,ca 1980 m,6 59'N 80 45'E,N/A,Typed,no type status,,
Entry 135,0143_C0003693F_collage.png,leg. H.K.,H. K.,N/A,s.n.,5.VII.1968,1968-07-05,N/A,Crucispora naucorioides HK. 1971 (Typus),Crucispora naucorioides,H. K.,1971,Cyathea dealbata | C. smithii | Phyllocladus | Podocarpus,New Zealand,N/A,N/A,N/A,Kauaeranga Valley Coromandel Peninsula N.Z.,Kauaeranga Valley Coromandel Peninsula,In humus unter Cyathea dealbata C. smithii Phyllocladus Podocarpus etc.,N/A,N/A,1017207,Typed,Typus,,
Entry 136,0144_C0004429F_collage.png,Singer,R. Singer,N/A,B 7463,14 V 1973,1973-05-14,N/A,Hygrocybe dimorphobasiditata Sing.,Hygrocybe dimorphobasiditata,R. Singer,N/A,N/A,Ecuador,Napo,N/A,Lago Agrio,Ecuador Napo Lago Agrio,Lago Agrio,Ad terram in hylaea,N/A,N/A,C0004426F,Typed,Typus,,
Entry 137,0145_C0004430F_collage.png,Singer,R. Singer,N/A,M10517,23 II 1988,1988-02-23,N/A,Hygrocybe fuegiana Sing. (= H. rosea sensu Horak),Hygrocybe fuegiana,N/A,N/A,Sphagnum | Rubus geoides,Argentina,Tierra del Fuego,Ushuaia,N/A,ya. road Ushuaia-Lago Fagnano SW of highest point,road Ushuaia-Lago Fagnano southwest of highest point,Gregarious in bog margin,N/A,N/A,1075922,Typed,Holotype,,
Entry 138,0178_C0000578F_collage.png,"John J. Engel, Matt von Konrat & John E. Braggins",J. J. Engel,M. von Konrat | J. E. Braggins,23773,12 February 2003,2003-02-12,N/A,Telaranea lindenbergii var. papillata Engel & Merr.,Telaranea lindenbergii,N/A,N/A,Blechnum novae-zelandiae | Weinmannia | Dicksonia squarrosa | Leptospermum scoparium,New Zealand,Auckland,N/A,N/A,"NORTH ISLAND. AUCKLAND PROV. Whareorino Forest, start of track to Leitch's Hut","Whareorino Forest, start of track to Leitch's Hut","On clayey bank. Clay banks with Blechnum novae-zelandiae overhang, Weinmannia and Dicksonia squarrosa dominant canopy and occasional Leptospermum scoparium",280 m,"38° 24.5' S, 174° 49.8' E",1173554,Typed,Holotype,,
Entry 139,0179_C2079898F_collage.png,Marko Lewis,M. Lewis,N/A,78-2684,21-22 November 1978,1978-11-21,1978-11-22,Kindbergia praelonga (Hedw.) Ochyra,Kindbergia praelonga,W. C. Steere,N/A,N/A,Ecuador,Imbabura,N/A,N/A,E. side of Cerro Cotacachi NW of Cotacachi 0°22'N 78°20'W,East side of Cerro Cotacachi northwest of Cotacachi,Wet bank of runoff ravine,3750 m,0°22'N 78°20'W,N/A,Typed,no type status,,
Entry 140,0180_C2077559F_collage.png,Marko Lewis,M. Lewis,N/A,78-3163,8 December 1978,1978-12-08,N/A,Hedwigia ciliata (Hedw.) P. Beauv.,Hedwigia ciliata,W. C. Steere,N/A,N/A,Ecuador,Azuay,N/A,N/A,"Area Nacional de Recreación ""Cajas"" forested hill S. of ""Surrochuco"" (Laguna Llaviuco) SW of Sayausi",Area Nacional de Recreación Cajas forested hill South of Surrochuco Laguna Llaviuco Southwest of Sayausi,Stone wall,3240 m,2°55'S 79°09'W,C0207559F,Typed,no type status,,
Entry 141,0181_C2077563F_collage.png,R. Benoist,R. Benoist,N/A,4659,N/A,0000-00-00,N/A,Hedwigia albicans (Web.) Lindb.,Hedwigia ciliata,E. De Luna | I. Thériot,1992 | N/A,N/A,Ecuador,N/A,N/A,N/A,environs de Quito,[precise locality unknown],N/A,N/A,N/A,1689453,Mix of Handwritten and Typed,no type status,,
Entry 142,0182_C2077564F_collage.png,Lég. R. Benoist,R. Benoist,N/A,2219,27 mars 1930,1930-03-27,N/A,Hedwigia albicans (Web.) Lindb.,Hedwigia ciliata,E. De Luna | L. Thériot,1992 | N/A,N/A,Ecuador,N/A,N/A,Quito,Sur rocher d'andésite. Quito.,Sur rocher d'andésite,N/A,N/A,N/A,1039455 | C2077564F,Typed,N/A,,
Entry 143,0183_C2077565F_collage.png,R. S. Williams,R. S. Williams,N/A,2850,April 30 1902,1902-04-30,N/A,Hedwigia albicans (W. J. Sm.) Mitt.,Hedwigia ciliata,E. De-Luna,1992,N/A,Bolivia,N/A,N/A,N/A,near Pelechuco,near Pelechuco,N/A,3500 meters,N/A,1039454,Mix of Handwritten and Typed,no type status,,
Entry 144,0184_C2077566F_collage.png,Marko Lewis,M. Lewis,N/A,79-1237A,22 March 1979,1979-03-22,N/A,Hedwigia ciliata (Hedw.) P. Beauv.,Hedwigia ciliata,E. De Luna,1992,N/A,Bolivia,La Paz,Larecaja,N/A,Near large red outcrop 2 mi. from Sorata down Rio Consata,Near large red outcrop 2 miles from Sorata down Rio Consata,Bromeliad habitat. Abundant on rock faces of exposed cliffs,2630 m.,15° 41' S. 68° 43' W.,C2077566F,Typed,no type status,,
Entry 145,0185_C2077567F_collage.png,Marko Lewis,M. Lewis,N/A,79-1232,22 March 1979,1979-03-22,N/A,Hedwigia ciliata (Hedw.) P. Beauv.,Hedwigia ciliata,E. De Luna,1992,N/A,Bolivia,La Paz,Larecaja,N/A,Near large red outcrop 2 mi. from Sorata down Rio Consata,Near large red outcrop 2 miles from Sorata down Rio Consata,Bromeliad-grass habitat on exposed cliffs,2630 m.,15° 41' S. 68° 43' W.,C2077567F,Typed,no type status,,
Entry 146,0186_C2077568F_collage.png,Marko Lewis,M. Lewis,N/A,79-1114,6 March 1979,1979-03-06,N/A,Hedwigia ciliata (Hedw.) P. Beauv.,Hedwigia ciliata,E. De Luna,1992,N/A,Bolivia,La Paz,Saavedra,N/A,"On mountain side directly N. of river, beneath Niño Karine, NNW of Chuma","On mountain side directly north of river, beneath Niño Karine, north-northwest of Chuma",Humid cliffs and steep slopes,3320 m,"15° 08' S., 69° 03' W",C2077568F,Typed,no type status,,
Entry 147,0187_C2077569F_collage.png,F. J. Hermann,F. J. Hermann,N/A,25152,"December 27, 1972",1972-12-27,N/A,Hedwigia ciliata (Hedw.) Beauv.,Hedwigia ciliata,E. De Luna,1992,N/A,Bolivia,Cochabamba,N/A,Cochabamba,"On conglomerate boulder on shrubby NW slope of Mt. Tunari, near Liriuni Aguas Termales Hotel, alt. ca. 2700 m., 23 km. NW.","On conglomerate boulder on shrubby northwest slope of Mount Tunari, near Liriuni Aguas Termales Hotel, 23 kilometers northwest",On conglomerate boulder on shrubby northwest slope,alt. ca. 2700 m.,N/A,C0207759F,Typed,no type status,,
Entry 148,0188_C2077570F_collage.png,Ynes Mexia,Y. Mexia,N/A,6204,"Dec. 2, 1931",1931-12-02,N/A,Pilotrichum subchlorophyllosum C. M.,Pilotrichum subchlorophyllosum,J. Bartram,N/A,N/A,Peru,Loreto,N/A,N/A,Above Pongo de Manseriche,Above Pongo de Manseriche,Streamlet near mouth of Rio Santiago. On fallen log.,Alt. 400 m.,N/A,1057692,Typed,no type status,,
Entry 149,0189_C2077571F_collage.png,Ynes Mexia,Y. Mexia,N/A,6204,"Dec. 2, 1931",1931-12-02,N/A,Pilosium subchlorophyllum,Pilosium subchlorophyllum,Bartram,N/A,N/A,Peru,Loreto,N/A,N/A,Above Pongo de Manseriche,Above Pongo de Manseriche,Streamlet near mouth of Rio Santiago On fallen log,Alt. 400 m,N/A,C207571F,Typed,no type status,,
Entry 150,0190_C2077572F_collage.png,A. C. Smith,A. C. Smith,N/A,2748,"Dec. 15-24, 1937",1937-12-15,1937-12-24,Aplozia flaccida C. M.,Aplozia flaccida,E. B. Bartram,N/A,N/A,Guyana,N/A,N/A,N/A,"Basin of Essequibo River, near mouth of Onoro Creek, lat. about 1°35' N.","Basin of Essequibo River, near mouth of Onoro Creek","On decayed wood, in swamp. Dense forest.",N/A,lat. about 1°35' N.,102751,Typed,no type status,,
Entry 151,0191_C2077573F_collage.png,J. Florschütz-de Waard & R. Zielman,J. Florschütz-de Waard,R. Zielman,5315,5-11-1981,1981-11-05,N/A,Pilosiom chlorophyllum (Hornsch.) C. Müll. c.fr.,Pilosiom chlorophyllum,R. Zielman,N/A,Cecropia,Suriname,Nickerie,N/A,N/A,area of Kabalebo Dam project distr. Nickerie line NW from road km 39.5 p. 5N 58W qu.SE,area of Kabalebo Dam project line northwest from road kilometer 39.5 point,Secondary wood with Cecropia (bospapaja) on rotting log,ALT. 0-50 m,5N 58W,C0207735F,Typed,no type status,,
Entry 152,0192_C2077574F_collage.png,J. Florschütz-de Waard & R. Zijlman,J. Florschütz-de Waard,R. Zijlman,5254,3-11-1991,1991-11-03,N/A,Pilosium chlorophyllum (Hornsch.) C. Müll.,Pilosium chlorophyllum,R. Zijlman,N/A,N/A,Suriname,Nickerie,N/A,N/A,area of Kabalebo Dam project distr. Nickerie line NW from road km 39.5 p. 5N 59W qu. SE,area of Kabalebo Dam project line Northwest from road kilometer 39.5 post 5N 59W quarter Southeast,Savanna forest on rotting log,0 - 50 m.,N/A,C2077574F,Typed,no type status,,
Entry 153,0193_C2077575F_collage.png,J. Florschütz-de Waard & R. Zijlman,J. Florschütz-de Waard,R. Zijlman,5098,30-10-1981,1981-10-30,N/A,Pilosium chlorophyllum (Hornsch.) C. Müll.,Pilosium chlorophyllum,R. Zijlman,N/A,N/A,Suriname,Nickerie,N/A,N/A,area of Kabalebo Dam project distr. Nickerie line W from road 34 km p. 5N 58W qu. SE,area of Kabalebo Dam project line West from road 34 kilometers point 5N 58W quadrant Southeast,Rainforest on rotting log,0 - 50 m.,N/A,C2077575F,Typed,no type status,,
Entry 154,0194_C2077576F_collage.png,"J. C. Lindeman, A. L. A. Görts-van Rijn, M. J. Jansen-Jacobs & A. M. C. Hetterscheid-Hollants",J. C. Lindeman,A. L. A. Görts-van Rijn | M. J. Jansen-Jacobs | A. M. C. Hetterscheid-Hollants,243 A,3-IX-1980,1980-09-03,N/A,Pilosium chlorophyllum (Hornsch.) C. Müll.,Pilosium chlorophyllum,H. R. Zielman,N/A,N/A,Suriname,Nickerie,N/A,N/A,"Area of Kabalebo Dam project, distr. Nickerie, Forest S of km 28.7","Area of Kabalebo Dam project, Forest South of kilometer 28.7",Epiphyte on tree trunk,Alt.: 30 - 130 m.,"5°09' N, 57°30'58"" W.",C2077576F,Typed,no type status,,
Entry 155,0195_C2077577F_collage.png,J. Florschütz-de Waard and R. Zielman,J. Florschütz-de Waard,R. Zielman,5141,31 October 1981,1981-10-31,N/A,Pilosium chlorophyllum (Hornsch.) C. Müll.,Pilosium chlorophyllum,R. Zielman,N/A,Astrocaryum,Suriname,Nickerie,N/A,N/A,"Distr. Nickerie, Kabalebo river area, line W. from road km 34, 5°N., 58°W.","Kabalebo river area, line W. from road kilometer 34",On decaying log in marsh forest with Astrocaryum,0-50 m,"5°N., 58°W.",G207757F,Typed,no type status,,
Entry 156,0196_C2077578F_collage.png,J. and P.A. Florschütz,J. Florschütz,P. A. Florschütz,4690,18 December 1975,1975-12-18,N/A,Pilosium chlorophyllum (Hornsch.) C. Muell.,Pilosium chlorophyllum,R. Zielman | J. Florschütz-de Waard,N/A,N/A,Suriname,N/A,N/A,N/A,"Brownsberg, trail to Leo Val","Brownsberg, trail to Leo Val",On rotting log in rainforest,alt. ca. 500 m,N/A,C2077578F,Typed,no type status,,
Entry 157,0197_C2077579F_collage.png,H. Cornelissen & S. R. Gradstein C076,H. Cornelissen,S. R. Gradstein,C076,8 March 1977,1977-03-08,N/A,Pilosium chlorophyllum (Hornsch.) C. Müll.,Pilosium chlorophyllum,J. Florschütz-de Waard,N/A,N/A,Guyana,N/A,N/A,N/A,"GUYANA. Mabura Hill, 180 km S of Georgetown, 5°20'N 58°40'W","Mabura Hill, 180 kilometers South of Georgetown",On rotting tree base in mixed rain forest,alt. 0-50 m,5°20'N 58°40'W,C0207759F,Typed,no type status,,
Entry 158,0198_C2077580F_collage.png,R. Spruce,R. Spruce,N/A,524,N/A,0000-00-00,N/A,Sturochylum chlorophyllum Hornsch.,Pilosium chlorophyllum,W. Mitten,N/A,N/A,Brazil,Para,N/A,N/A,Fl. Amazon prope Para,[precise locality unknown],N/A,N/A,N/A,C0277580F | 1078188,Mix of Handwritten and Typed,no type status,,
Entry 159,0199_C2077581F_collage.png,Richard Evans Schultes and Isidoro Cabrera,R. E. Schultes,I. Cabrera,7922,"Oct. 22, 1952",1952-10-22,N/A,Pilosium chlorophyllum (Hornsch.) Jaeg.,Pilosium chlorophyllum,H. A. Crum,1956,N/A,Colombia,Vaupés,N/A,N/A,Río Vaupés: Mitú and vicinity,Cerro Mitú,On rotten log,N/A,"Lat. 1° 0' N, Long. 70° 6' W",C0207581F,Typed,no type status,,
Entry 160,0200_C2077582F_collage.png,Richard Evans Schultes et Isidoro Cabrera,R. E. Schultes,I. Cabrera,14294,"October 4-6, 1951",1951-10-04,1951-10-06,Pilosius chlorophyllum (Hornsch.) C. M.,Pilosius chlorophyllum,H. A. Crum,1956,N/A,Colombia,Vaupés,N/A,N/A,"Rio Kuduyari (affluent of Rio Vaupés), Yapobodá, quartzite savannah","Rio Kuduyari, Yapobodá",On rotten logs,N/A,N/A,C00775692F,Typed,no type status,,
Entry 161,0201_C2077583F_collage.png,RICHARD EVANS SCHULTES,R. E. Schultes,N/A,12309,June 1951,1951-06-00,N/A,PILOSIUM CHLOROPHYLLUM (HORNSCH.) C. M. IN BROTH.,Pilosium chlorophyllum,D. Griffin III,N/A,N/A,Colombia,Vaupés,N/A,N/A,Rio Apaporis. Soratama,Rio Apaporis. Soratama,On trunks,N/A,N/A,N/A,Typed,no type status,,
Entry 162,0202_C2077584F_collage.png,,,,,,,,,,,,,,,,,,,,,,,,,,
Entry 163,0203_C2077585F_collage.png,Ynes Mexia,Y. Mexia,N/A,6014a,"Aug. 31, 1931",1931-08-31,N/A,Filosum chlorophyllum (Hsch.) C. M.,Filosum chlorophyllum,N/A,N/A,N/A,Brazil,Pará,Acará,N/A,Thomé Assú; down Rio Acará 3 km.,Thomé Assú; down Rio Acará 3 kilometers,On fallen log,Alt. 35 m.,N/A,C027586F,Typed,no type status,,
Entry 164,0204_C2077586F_collage.png,Ynes Mexia,Y. Mexia,N/A,5914,"July 16, 1931",1931-07-16,N/A,Pilosiun Chlorophyllosum (Hsch.) C. M.,Pilosiun Chlorophyllosum,N/A,N/A,N/A,Brazil,Pará,Acará,N/A,Thomé Assu. Japanese Colony.,Thomé Assu. Japanese Colony.,On rotting log in woods. Abundant.,Alt. about 30 m.,N/A,870829,Typed,no type status,,
Entry 165,0205_C2078862F_collage.png,"leg. Dana Griffin, III Manuel López F.",D. Griffin,M. López,PV-1525,14 marzo 1985,1985-03-14,N/A,Brachythecium plumosum (Hedw.) BSG,Brachythecium plumosum,D. Griffin,N/A,Expeweletia schultzii,Venezuela,Trujillo,N/A,N/A,"páramo de Guirigay, arriba del pueblo de Las Piedras. Entre el río Buey y Penas Blancas","páramo de Guirigay, arriba del pueblo de Las Piedras. Entre el río Buey y Penas Blancas","Sobre roca húmeda, lecho de riachuelo, a sol",3300 m,N/A,C02078862F,Typed,no type status,,
Entry 166,0206_C2078913F_collage.png,P. Dusén,P. Dusén,N/A,5872,22 February 1897,1897-02-22,N/A,Brachythecium albicans (Hedw.) Schimp.,Brachythecium albicans,W. R. Buck,N/A,N/A,Chile,N/A,N/A,N/A,"Patagonia occident., Cerra Colorado",Cerra Colorado,N/A,N/A,N/A,B11749,Typed,no type status,,
Entry 167,0207_C2078924F_collage.png,Ynes Mexia,Y. Mexia,N/A,8001,"April 10, 1936",1936-04-10,N/A,Brachythecium sublosum (H. f. & W. Jlaeg.),Brachythecium austro-glareosum,Bartram,N/A,Nothofagus,Chile,Magallanes,N/A,N/A,Last Hope Inlet; Peninsula Antonio Varas,Last Hope Inlet; Peninsula Antonio Varas,Openings in Nothofagus wood in moist earth. Common; scattered in small turfs.,Alt. 25 m.,N/A,1036758 | C2073924F,Typed,no type status,,
Entry 168,0208_C2078925F_collage.png,Marko Lewis,M. Lewis,N/A,79-2108,25 May 1979,1979-05-25,N/A,Brachythecium calliergonioides Broth. in Herz.,Brachythecium calliergonioides,R. Ochyra,1982,N/A,Bolivia,Oruro,Sajama,N/A,Río Junthuma Khuchu 2 mi. down river from Aguas termales de Río Junthuma Khuchu,Río Junthuma Khuchu 2 miles down river from Aguas termales de Río Junthuma Khuchu,In warmish creek,4350 m,18° 07' S. 69° 00' W.,C2078925F,Typed,no type status,,
Entry 169,0209_C2078926F_collage.png,Marko Lewis,M. Lewis,N/A,79-2109,25 May 1979,1979-05-25,N/A,Brachythecium calliergonioides Broth. in Herz.,Brachythecium calliergonioides,R. Ochyra,1982,N/A,Bolivia,Oruro,Sajama,N/A,"Rio Junthuma Khuchu, 2 mi. down river from Aguas termales de Rio Junthuma Khuchu","Rio Junthuma Khuchu, 2 miles down river from Aguas termales de Rio Junthuma Khuchu",In warmish creek,4350 m,"18° 07' S, 69° 00' W",C2078926F,Typed,no type status,,
Entry 170,0210_C2078927F_collage.png,Marko Lewis,M. Lewis,N/A,79-2112,25 May 1979,1979-05-25,N/A,Brachythecium calliergonioides Broth. in Herz.,Brachythecium calliergonioides,R. Ochyra,1982,N/A,Bolivia,Oruro,Sajama,N/A,"Río Junthuma Khuchu, 2 mi. down river from Aguas termales de Río Junthuma Khuchu","Río Junthuma Khuchu, 2 miles down river from Aguas termales de Río Junthuma Khuchu",In warmish creek,4350 m,"18° 07' S, 69° 00' W",C2078927F,Typed,no type status,,
Entry 171,0211_C2078928F_collage.png,Marko Lewis,M. Lewis,N/A,79-2115,25 May 1979,1979-05-25,N/A,Brachythecium calliergonioides Broth. in Herz.,Brachythecium calliergonioides,R. Ochyra,1982,N/A,Bolivia,Oruro,Sajama,N/A,"Río Junthuma Khuchu, 2 mi. down river from Aguas termales de Río Junthuma Khuchu","Río Junthuma Khuchu, 2 miles down river from Aguas termales de Río Junthuma Khuchu",In warmish creek,4350 m,"18° 07' S, 69° 00' W",C2078928F,Typed,no type status,,
Entry 172,0212_C2078929F_collage.png,Marko Lewis,M. Lewis,N/A,79-2117,25 May 1979,1979-05-25,N/A,Brachythecium calliergonioides Broth. in Herz.,Brachythecium calliergonioides,R. Ochyra,1982,N/A,Bolivia,Oruro,Sajama,N/A,"Río Junthuma Khuchu, 2 mi. down river from Aguas termales de Río Junthuma Khuchu","Río Junthuma Khuchu, 2 miles down river from Aguas termales de Río Junthuma Khuchu",In warmish creek,4350 m,"18° 07' S., 69° 00' W.",C02078629F,Typed,no type status,,
Entry 173,0213_C2078930F_collage.png,Marko Lewis,M. Lewis,N/A,79-2118,25 May 1979,1979-05-25,N/A,Brachythecium calliergonioides Broth. in Herz.,Brachythecium calliergonioides,R. Ochyra,1982,N/A,Bolivia,Oruro,Sajama,N/A,"Rio Junthuma Khuchu, 2 mi. down river from Aguas termales de Rio Junthuma Khuchu","Rio Junthuma Khuchu, 2 miles down river from Aguas termales de Rio Junthuma Khuchu",In warmish creek,4350 m,"18° 07' S, 69° 00' W",C0207830F,Typed,no type status,,
Entry 174,0214_C2078931F_collage.png,Marko Lewis,M. Lewis,N/A,79-2107,25 May 1979,1979-05-25,N/A,Brachythecium calliergonioides Broth. in Herz.,Brachythecium calliergonioides,R. Ochyra,1982,N/A,Bolivia,Oruro,Sajama,N/A,"Río Junthuma Khuchu, 2 mi. down river from Aguas termales de Río Junthuma Khuchu","Río Junthuma Khuchu, 2 miles down river from Aguas termales de Río Junthuma Khuchu",In warmish creek,4350 m.,"18° 07' S., 69° 00' W.",C2078931F | C2078931F,Typed,no type status,,
Entry 175,0215_C2078932F_collage.png,Marko Lewis,M. Lewis,N/A,79-2119,25 May 1979,1979-05-25,N/A,Brachythecium calliergonioides Broth. in Herz.,Brachythecium calliergonioides,R. Ochyra,1982,N/A,Bolivia,Oruro,Sajama,N/A,"Rio Junthuma Khuchu, 2 mi. down river from Aguas termales de Rio Junthuma Khuchu","Rio Junthuma Khuchu, 2 miles down river from Aguas termales de Rio Junthuma Khuchu",In warmish creek,4350 m,"18° 07' S., 69° 00' W.",C2078932F,Typed,no type status,,
Entry 176,0216_C2079350F_collage.png,Ynes Mexia,Y. Mexia,N/A,6149,"Nov. 23, 1931",1931-11-23,N/A,Vesicularia amphibola (Spr.) Broth.,Vesicularia amphibola,N. Bartram,N/A,N/A,Peru,Loreto,N/A,N/A,Above Pongo de Manseriche Left bank of Rio Santiago,Above Pongo de Manseriche Left bank of Rio Santiago,On stone in overflow forest,Alt. 200 m.,N/A,873368,Typed,no type status,,
Entry 177,0217_C2079351F_collage.png,Yves Mexia,Y. Mexia,N/A,6160-a,"Nov. 25, 1931",1931-11-25,N/A,Vesicularia amphibola (Spr.) Broth.,Vesicularia amphibola,M. Bartram,N/A,N/A,Peru,Loreto,N/A,N/A,Above Pongo de Manseriche Right bank of Rio Santiago,Above Pongo de Manseriche Right bank of Rio Santiago,Dense forest on log,Alt. 200 m.,N/A,873367 | C2070351F,Typed,no type status,,
Entry 178,0218_C2079352F_collage.png,Ynes Mexia,Y. Mexia,N/A,6217-a,"Dec. 4, 1931",1931-12-04,N/A,Vesicularia amphibola (Spr.) Broth.,Vesicularia amphibola,N/A,N/A,N/A,Peru,Loreto,N/A,N/A,Above Pongo de Manseriche,Above Pongo de Manseriche,Streamlet on right bank of Rio Santiago On rocks wet by spray,Alt. 250 m,N/A,870879,Typed,no type status,,
Entry 179,0219_C2079353F_collage.png,Ynes Mexia,Y. Mexia,N/A,6259-a,"Dec. 12, 1931",1931-12-12,N/A,Vesicularia amphibola (Spr.) Broth.,Vesicularia amphibola,Extram,N/A,N/A,Peru,Loreto,N/A,N/A,Above Pongo de Manseriche,Above Pongo de Manseriche,Creek Carapias bog in forest,Alt. 215 m.,N/A,C2079354F,Typed,no type status,,
Entry 180,0220_C2079354F_collage.png,Ynes Mexia,Y. Mexia,N/A,6354-a,"Jan. 3, 1932",1932-01-03,N/A,Vesicularia amphibola (Spr.) Broth.,Vesicularia amphibola,E. Bartram,N/A,N/A,Peru,Loreto,N/A,N/A,Above Pongo de Manseriche,Above Pongo de Manseriche,Creek Inche. On earth collected on inclined tree trunk.,Alt. 215 m.,N/A,873369,Typed,no type status,,
Entry 181,0221_C2079355F_collage.png,Ynes Mexia,Y. Mexia,N/A,6375a,"Jan. 3, 1932",1932-01-03,N/A,Vesicularia amphibia (Spr.) Broth.,Vesicularia amphibia,N/A,N/A,Taxithelium planum,Peru,Loreto,N/A,N/A,Above Pongo de Manseriche Creek Inche,Above Pongo de Manseriche Creek Inche,On rotten log Sterile,Alt. 215 m.,N/A,C02073355F,Typed,no type status,,
Entry 182,0222_C2079356F_collage.png,Ynes Mexia,Y. Mexia,N/A,6375-m,"Jan. 3, 1935",1935-01-03,N/A,Vexillaria amphiola (Spr.) Dreter,Vexillaria amphiola,J. A. Steyermark,N/A,Taxithelium planum,Peru,Loreto,N/A,N/A,Above Pongo de Manseriche,Above Pongo de Manseriche,Creek Inchs. On rotten log. Sterile.,Alt. 215 m.,N/A,870880 | C02073956F,Typed,no type status,,
Entry 183,0223_C2079357F_collage.png,Ynes Mexia,Y. Mexia,N/A,6377,"Jan. 3, 1932",1932-01-03,N/A,Vesicularia amphibola (Spr.) Broth.,Vesicularia amphibola,E. Bartram,N/A,N/A,Peru,Loreto,N/A,N/A,Above Pongo de Manseriche,Above Pongo de Manseriche,Creek Inche. On rotten log.,Alt. 215 m.,N/A,870873,Typed,no type status,,
Entry 184,0224_C2079358F_collage.png,Ynes Mexia,Y. Mexia,N/A,8070,"May 14, 1936",1936-05-14,N/A,Vesicularia amphibia (Spr.) Broth. in mixtype,Vesicularia amphibia,N/A,N/A,N/A,Peru,Cuzco,La Convencion,N/A,upper valley of the Sambray; affluent of the Vilcanota; on rotten logs in virgin forest,upper valley of the Sambray; affluent of the Vilcanota,on rotten logs in virgin forest,Alt. 1800 m,N/A,108318,Typed,no type status,,
Entry 185,0225_C2079359F_collage.png,Ynes Mexia,Y. Mexia,N/A,8070,"May 14, 1936",1936-05-14,N/A,Vesicularia amphibia (Spr.) Broth. in mixture,Vesicularia amphibia,N/A,det. Bartram,N/A,Peru,Cuzco,La Convencion,N/A,upper valley of the Sambray; affluent of the Vilcanota; on rotten logs in virgin forest,upper valley of the Sambray; affluent of the Vilcanota,on rotten logs in virgin forest,Alt. 1800 m.,N/A,C2079359F,Typed,no type status,,
Entry 186,0226_C2079360F_collage.png,Reitz,R. Reitz,N/A,5468,2.2.1950,1950-02-02,N/A,Vesicularia vesicularis (Schwagr.) Broth.,Vesicularia vesicularis,J. L. Lima,1949,N/A,Brazil,Santa Catarina,N/A,N/A,"Itambajé, Braço","Itambajé, Braço","Epífito, da mata virgem",Alti. 50 m,N/A,2077906,Typed,No type status,,
Entry 187,0227_C2079361F_collage.png,F. J. Hermann,F. J. Hermann,N/A,25019,"December 19, 1972",1972-12-19,N/A,Vesicularia vesicularis (Schwaegr.) Broth.,Vesicularia vesicularis,H. Robinson,N/A,N/A,Colombia,Santander,N/A,N/A,"On base of tree trunk, Paraguitas, 1/4 mile NW","Paraguitas, 1/4 mile Northwest",On base of tree trunk,alt. ca. 4000 ft.,N/A,C2073086F,Typed,no type status,,
Entry 188,0228_C2079362F_collage.png,RICHARD EVANS SCHULTES,R. E. Schultes,N/A,11107,"Dec., 1950",1950-12-00,N/A,Vesicularia vesicularis (Schwgr.) Broth.,Vesicularia vesicularis,D. Griffin,N/A,N/A,Colombia,Meta,N/A,Villavicencio,alrededores de Villavicencio,[precise locality unknown],N/A,Alt. 500 m.,N/A,C2079362F,Typed,no type status,,
Entry 189,0229_C2079715F_collage.png,,,,,,,,,,,,,,,,,,,,,,,,,,
Entry 190,0230_C2079716F_collage.png,Paul C. Hutchison | J. Kenneth Wright,P. C. Hutchison,J. K. Wright,1806,1 April 1964,1964-04-01,N/A,Entodon jamesonii (Tayl.) Mitt.,Entodon jamesonii,H. Robinson,1966,N/A,Peru,Amazonas,N/A,N/A,"Cerros Calla Calla, east side, 5 km. above Leimebamba on the road to Balsas, at San Miguel (no buildings at this locality)","Cerros Calla Calla, east side, 5 kilometers above Leimebamba on the road to Balsas, at San Miguel",N/A,Altitude 2400 m.,N/A,1012131,Typed,no type status,,
Entry 191,0231_C2079717F_collage.png,,,,,,,,,,,,,,,,,,,,,,,,,,
Entry 192,0232_C2079718F_collage.png,Ynes Mexia,Y. Mexia,N/A,5687,"April 21, 1931",1931-04-21,N/A,Entodon Lindbergii Ren.,Entodon lindbergii,E. Bartram,N/A,N/A,Brazil,Minas Gerais,N/A,Corinto,Fazenda do Diamante. Campo Tiririca. Base of living tree in shade.,Fazenda do Diamante. Campo Tiririca. Base of living tree in shade.,Base of living tree in shade.,Alt. 500 m.,N/A,870818,Typed,no type status,,
Entry 193,0233_C2079719F_collage.png,R. Spruce,R. Spruce,N/A,1023,N/A,0000-00-00,N/A,Entodon longisetus Hook.,Entodon longisetus,W. Mitten,N/A,N/A,Ecuador,N/A,N/A,Baños,Andes Quitenses Baños,Baños,N/A,N/A,N/A,1078203,Mix of Handwritten and Typed,N/A,,
Entry 194,0234_C2079720F_collage.png,Marko Lewis,M. Lewis,N/A,79-590,8 February 1979,1979-02-08,N/A,Entodon cf. nano-climacium C.M. (= E. micans Herz.),Entodon nano-climacium,W. Buck,1980,N/A,Bolivia,Tarija,Méndez,Cercado,"Canyon 5 mi. SW of Tablada, SW of Tarija","Canyon 5 miles southwest of Tablada, southwest of Tarija",Bank of creek,2160 m.,21° 36' S. 64° 48' W.,C2079720F,Typed,no type status,,
Entry 195,0235_C2079721F_collage.png,Marko Lewis,M. Lewis,N/A,79-1220,22 March 1979,1979-03-22,N/A,Entodon nano-climacium C. M. (= E. micans Herz.),Entodon nano-climacium,W. Buck,1980,N/A,Bolivia,La Paz,Larecaja,N/A,Near large red outcrop 2 mi. from Sorata down Río Consata,Near large red outcrop 2 miles from Sorata down Río Consata,Very shady ground along creek in humid shrubs,2600 m.,"15° 41' S., 68° 43' W.",C0209721F,Typed,no type status,,
Entry 196,0236_C2079722F_collage.png,Collected by Harry Ward Foote,H. W. Foote,N/A,s.n.,Sept. 3,1911-09-03,N/A,Entosthodon platyphyllus C. M.,Entosthodon platyphyllus,unsure and check,N/A,N/A,Peru,N/A,N/A,San Miguel,On rocks above San Miguel,On rocks above San Miguel,N/A,10000 ft,N/A,N/A,Mix of Handwritten and Typed,no type status,,
Entry 197,0237_C2079723F_collage.png,Marko Lewis,M. Lewis,N/A,79-1346,1 April 1979,1979-04-01,N/A,cf. Entodon polycarpus,Entodon polycarpus,W. Buck,1980,N/A,Bolivia,La Paz,Larecaja,N/A,Between Abra Huallata and waterfall at Millipaya,Between Abra Huallata and waterfall at Millipaya,"Waterfall ravine, highest extension of shrubs",3780 m,"15° 51' S, 68° 39' W",C0297323F,Typed,no type status,,
Entry 198,0238_C2079595F_collage.png,H. Roivainen,H. Roivainen,N/A,2095,25.1.1970,1970-01-25,N/A,Isopterygium pulchellum (Hedw.) Jaeg.,Isopterygium pulchellum,R. Ochyra,1996,Nothofagus pumilio,Argentina,Tierra del Fuego,Ushuaia,N/A,Arroyo Grande en fisuras de roca y en raizes humoso-arcillosos de Nothofagus pumilio en orilla de la cascada,Arroyo Grande,en fisuras de roca y en raizes humoso-arcillosos de Nothofagus pumilio en orilla de la cascada,150 m s.m.,54°47'S 68°17'W,N/A,Typed,no type status,,
Entry 199,0239_C2079596F_collage.png,H. Roivainen,H. Roivainen,N/A,1352,24.12.1969,1969-12-24,N/A,Isopterygium pulchellum (Brid.) Jaeg.,Isopterygium pulchellum,R. Ochyra,1996,N/A,Argentina,Tierra del Fuego,N/A,Ushuaia,Valle del río Pipo,Valle del rio Pipo,suelo humoso húmedo en el pendiente del río bastante copiosamente,300 m s.m.,"51°46'S, 68°20'W",C2079596F,Typed,no type status,,
Entry 200,0240_C2079597F_collage.png,E. P. Killip & A. C. Smith,E. P. Killip,A. C. Smith,14871,"November 29, 1926",1926-11-29,N/A,Isopterygium stigmocarpum (C. M.) Par.,Isopterygium tenerum,R. R. Ireland,1988,N/A,Colombia,Santander,N/A,N/A,between Puerto Wilches and Puerto Santos,between Puerto Wilches and Puerto Santos,N/A,alt. 110-115 m.,N/A,N/A,Typed,no type status,,
Entry 201,0241_C2079598F_collage.png,RICHARD EVANS SCHULTES,R. E. Schultes,N/A,1110,"Dec., 1950",1950-12-00,N/A,Isopterygium tenerum (Sw.) Mitt.,Isopterygium tenerum,D. Griffin III,N/A,N/A,Colombia,Meta,N/A,Villavicencio,alrededores de Villavicencio,[precise locality unknown],N/A,Alt. 500 m.,N/A,N/A,Typed,no type status,,
Entry 202,0242_C2079599F_collage.png,D. C. Geijskes,D. C. Geijskes,N/A,s.n.,29 - 9 - 1952,1952-09-29,N/A,Isopterygium tenerum (Sw.) Mitt.,Isopterygium tenerum,H. R. Zielman,N/A,N/A,Suriname,N/A,N/A,N/A,Jarrowka River; Amima falls,Jarrowka River; Amima falls,"Rainforest On roots and rocks on bank of river, shade",N/A,N/A,N/A,Typed,no type status,,
Entry 203,0243_C2079600F_collage.png,Ynes Mexia,Y. Mexia,N/A,4341,July 8 1930,1930-07-08,N/A,Isopterygium brachyneuron (C M) Mitt. ex. Bartram,Isopterygium tenerum,R. R. Ireland,1988,N/A,Brazil,Minas Gerais,N/A,Vicosa,Agricultural College land Horticultural Hill,Agricultural College land Horticultural Hill,Out over woods near base on rotting log Abundant,Alt. 670 m,N/A,N/A,Typed,N/A,,
Entry 204,0244_C2079601F_collage.png,Ynes Mexia,Y. Mexia,N/A,4888,"July 21, 1930",1930-07-21,N/A,Isopterygium laxum (Hpe.) Broth.,Isopterygium tenerum,E. Bartram,N/A,N/A,Brazil,Minas Gerais,N/A,N/A,Viçosa Agricultural College lands,Viçosa Agricultural College lands,Shady streambank On rotten wood,Alt. 675 m.,N/A,873365,Typed,no type status,,
Entry 205,0245_C2079602F_collage.png,Ynes Mexia,Y. Mexia,N/A,5386,"Dec. 9, 1930",1930-12-09,N/A,Isopterygium brachypus var. mucronatum (C. Muell.) Mitt.,Isopterygium tenerum,N. L. Bertram | R. R. Ireland,1988,N/A,Brazil,Minas Gerais,N/A,Viçosa,Road to São Miguel. About km 4.8,Road to São Miguel. About 4.8 kilometers,Dense forest. On rotten log. In fruit,Alt. 710 m.,N/A,870841,Typed,no type status,,
Entry 206,0246_C2079603F_collage.png,Ynes Mexia,Y. Mexia,N/A,5441,"Dec. 23, 1930",1930-12-23,N/A,Isopterygium laxum (Hpe.) Broth.,Isopterygium tenerum,N/A,N/A,N/A,Brazil,Minas Gerais,N/A,N/A,Base of Horticultural Hill,Base of Horticultural Hill,On rotting logs in woods Abundant,Alt. 670 m.,N/A,870823,Typed,no type status,,
Entry 207,0247_C2079604F_collage.png,"H. S. Irwin, R. M. Harley, G. L. Smith",H. S. Irwin,R. M. Harley | G. L. Smith,31332,2 March 1971,1971-03-02,N/A,Isopterygium tenerum (Sw.) Mitt.,Isopterygium tenerum,R. R. Ireland,1988,Coccoloba sp.,Brazil,Bahia,N/A,N/A,Valley of the Rio das Ondas ca. 10km W. of Barreiras,Valley of the Rio das Ondas ca. 10 kilometers West of Barreiras,On the bark and exposed roots of Coccoloba sp. and on adjacent soil at river bank Cut-over gallery forest and adjacent cerrado,ca. 500m,N/A,N/A,Typed,no type status,,
Entry 208,0248_C2079606F_collage.png,Ynes Mexia,Y. Mexia,N/A,4884,"July 21, 1929",1929-07-21,N/A,Isopterygium auriculatum (C. M.) Mitt.,Isopterygium tenerum,J. Bartram,N/A,N/A,Brazil,Minas Gerais,N/A,N/A,Viçosa Agricultural College lands. Córrego Ribeiro,Viçosa Agricultural College lands. Córrego Ribeiro,"Shady streambank, on rotten log. Abundant",Alt. 675 m.,N/A,870845,Typed,no type status,,
Entry 209,0249_C2079607F_collage.png,Ynes Mexia,Y. Mexia,N/A,4698,"May 14, 1930",1930-05-14,N/A,Isopterygium curvicollum (C. M.) Mitt. ex p.,Isopterygium tenerum,N/A,N/A,N/A,Brazil,Minas Gerais,N/A,Vicosa,Fazenda de Cresiuma,Fazenda de Cresiuma,Wood on slope. On rotten log.,Alt. 700 m.,N/A,870839,Typed,no type status,,
Entry 210,0250_C2079608F_collage.png,Ynes Mexia,Y. Mexia,N/A,4884,"July 21, 1930",1930-07-21,N/A,Isopterygium curvicollum (C. M.) Mitt.,Isopterygium tenerum,N/A,N/A,N/A,Brazil,Minas Gerais,N/A,N/A,"Vicosa Agricultural College lands. Corriga Riberro. Shady streambank, on rotten log.",Vicosa Agricultural College lands. Corriga Riberro,"Shady streambank, on rotten log. Abundant.",Alt. 675 m.,N/A,N/A,Typed,no type status,,
Entry 211,0251_C2079609F_collage.png,Ynes Mexia,Y. Mexia,N/A,4545,"March 31, 1930",1930-03-31,N/A,Isopterygium curvifolium (Lindb.) Mitt.,Isopterygium tenerum,R. R. Ireland | Bartram,1988,N/A,Brazil,Minas Gerais,N/A,N/A,"Road to São Miguel Near stream ""Turca""",Road to São Miguel Near stream Turca,Cut over woods on slope On rotting tree trunk,Alt. 710 m.,N/A,N/A,Typed,no type status,,
Entry 212,0252_C2079611F_collage.png,leg. V. Schiffner,V. Schiffner,N/A,2898,m. Jul. Fr. Cem. XXV. fasc. I. Dec. 65-67,1965-07-00,1967-12-00,Isopterygium aurantiacum (C. M.) Broth.,Isopterygium tenerum,V. F. Brotherus | R. R. Ireland,1988,N/A,Brazil,Sao Paulo,N/A,Cerqueira Cesar,prope urbem Cerqueira-Cesar in palude c. 500 m s. m.,near the city Cerqueira Cesar in marsh about 500 meters,in marsh,c. 500 m s. m.,N/A,1012176,Mix of Handwritten and Typed,no type status,,
Entry 213,0253_C2079856F_collage.png,Ynes Mexia,Y. Mexia,N/A,4641,"July 6, 1930",1930-07-06,N/A,Isopterygium brachynueron (C. Muell.) Mitt. ex Broth.,Isopterygium tenerum,E. Bartram,N/A,N/A,Brazil,Minas Gerais,N/A,N/A,Vicosa Agricultural College lands,Vicosa Agricultural College lands,Horticultural Hill. Cut over woods near base. On rotting log. Abundant.,Alt. 670 m.,N/A,870887,Typed,no type status,,
Entry 214,0254_C2079858F_collage.png,R. S. Williams,R. S. Williams,N/A,2095,"Nov. 29, 1901",1901-11-29,N/A,Isopterygium tenerum (Sw.) Mitt.,Isopterygium tenerum,R. R. Ireland,1988,N/A,Bolivia,N/A,N/A,N/A,"San Buena Ventura, 190 meters, on bank","San Buena Ventura, on bank",N/A,190 meters,N/A,N/A,Mix of Handwritten and Typed,no type status,,
Entry 215,0255_C2079859F_collage.png,Collected by R. S. Williams 1901-1902,R. S. Williams,N/A,2058,1901-1902,1901-00-00,1902-00-00,Isopterygium tenerum (Sw.) Mitt.,Isopterygium tenerum,R. S. Williams,23 Jan. 1902,N/A,Bolivia,N/A,N/A,N/A,Tumupasa,Tumupasa,N/A,N/A,N/A,1017412,Mix of Handwritten and Typed,no type status,,
Entry 216,0256_C2010970F_collage.png,leg. C. D. Krog,C. D. Krog,N/A,s.n.,27/7 1907,1907-07-27,N/A,Bryopodium unigerum (R.) var. et humile (Webl.),Bryopodium unigerum,N/A,N/A,N/A,Norway,Trøndelag,N/A,Oppdal,N/A,Vaarstigen,N/A,aldit. mtr. 900,N/A,C0207939F,Mix of Handwritten and Typed,no type status,,
Entry 217,0257_C2010972F_collage.png,N/A,N/A,N/A,s.n.,s.d.,0000-00-00,N/A,Pogonatum urnigerum Brid,Pogonatum urnigerum,N/A,N/A,N/A,England,N/A,N/A,N/A,England,[precise locality unknown],N/A,N/A,N/A,C2010972F,Mix of Handwritten and Typed,no type status,,
Entry 218,0258_C2000534F_collage.png,N/A,N/A,N/A,s.n.,1878,1878-00-00,N/A,Pogonatum urnigerum,Pogonatum urnigerum,N/A,APR1951,N/A,France,N/A,N/A,N/A,Pyrénées: Gorge de Jeret,Gorge de Jeret,N/A,1500,N/A,The Field Museum EP 0001878,Mix of Handwritten and Typed,no type status,,
Entry 219,0259_C2000536F_collage.png,N/A,N/A,N/A,s.n.,N/A,0000-00-00,N/A,Pogonatum urnigerum,Pogonatum urnigerum,N/A,N/A,N/A,England,Sussex,N/A,N/A,"Sussex, England",[precise locality unknown],N/A,N/A,N/A,1096014,Mix of Handwritten and Typed,no type status,,
Entry 220,0260_C2000538F_collage.png,W. M. Canby,W. M. Canby,N/A,s.n.,N/A,0000-00-00,N/A,Lycopodium unigerum,Lycopodium unigerum,N/A,N/A,N/A,United States,Delaware,N/A,N/A,N/A,[precise locality unknown],N/A,N/A,N/A,1182972,Mix of Handwritten and Typed,no type status,,
Entry 221,0261_C2000542F_collage.png,leg. Jeanpert,E. Jeanpert,N/A,s.n.,19/9/94,1894-09-19,N/A,Pogonatum urnigerum,Pogonatum urnigerum,N/A,N/A,N/A,France,Vosges,N/A,N/A,"rock de Servance, versant est",rock de Servance,N/A,N/A,N/A,1058477,Handwritten,no type status,,
Entry 222,0262_C2000932F_collage.png,C. Müller Frib.,C. Müller,N/A,476,Sept. 1905,1905-09-00,N/A,Pogonatum urnigerum (L.) Pal. Beauv. c. fr.,Pogonatum urnigerum,N/A,N/A,N/A,Germany,Baden-Württemberg,N/A,N/A,Baden: auf Erde in Felsritzen zwischen Rinken und Seebrick am Feldberg etwa 1250 m s. m.,Rinken and Seebrick at Feldberg,auf Erde in Felsritzen,etwa 1250 m s. m.,N/A,1194391,Typed,no type status,,
Entry 223,0263_C2000934F_collage.png,leg. Zd. Pilous,Z. Pilous,N/A,s.n.,V. 1946,1946-05-00,N/A,24. Pogonatum urnigerum P. B.,Pogonatum urnigerum,unsure and check,N/A,N/A,Czech Republic,N/A,N/A,N/A,Bohemia Montes Krkonoše In declivis graminosis silvaticis prope pagum Horní Vrchlabí ca 580 m,Horní Vrchlabí,In declivis graminosis silvaticis,ca 580 m,N/A,1270015,Typed,no type status,,
Entry 224,0264_C2000936F_collage.png,Collected in 1843 by James Thompson,J. Thompson,N/A,s.n.,1843,1843-00-00,N/A,Pogonatum urnigerum,Pogonatum urnigerum,J. F. Smith,Sept 1942,N/A,Scotland,N/A,N/A,N/A,N/A,[precise locality unknown],N/A,N/A,N/A,1230970,Typed,no type status,,
Entry 225,0265_C2000938F_collage.png,leg Philippe,Philippe,N/A,s.n.,N/A,0000-00-00,N/A,Hypnum vernigerum,Hypnum vernigerum,N/A,N/A,N/A,N/A,N/A,N/A,N/A,Serra do Lôvôsi,Serra do Lôvôsi,N/A,N/A,N/A,1058446,Mix of Handwritten and Typed,no type status,,
Entry 226,0266_C2000940F_collage.png,N/A,N/A,N/A,s.n.,1945,1945-00-00,N/A,"Pogonatum urnigerum, Beauv",Pogonatum urnigerum,N/A,N/A,N/A,Germany,N/A,N/A,N/A,N/A,[precise locality unknown],N/A,N/A,N/A,115925,Mix of Handwritten and Typed,no type status,,
Entry 227,0267_C2000943F_collage.png,C. Jensen,C. Jensen,N/A,s.n.,25/10 1901,1901-10-25,N/A,Pogonatum urnigerum (Hedw.) P. B.,Pogonatum urnigerum,C. Jensen,N/A,N/A,Denmark,Sjælland,N/A,N/A,Magistratskoven by Hvalsø in a gravel-pit,Magistratskoven by Hvalsø,in a gravel-pit,N/A,N/A,C200004345F,Typed,no type status,,
Entry 228,0268_C2000945F_collage.png,N/A,N/A,N/A,s.n.,s.d.,0000-00-00,N/A,N/A,N/A,N/A,N/A,N/A,N/A,N/A,N/A,N/A,N/A,[precise locality unknown],N/A,N/A,N/A,1058475,Typed,no type status,,
Entry 229,0269_C2000947F_collage.png,Herbier Ed. Jeanpert,E. Jeanpert,N/A,s.n.,s.d.,0000-00-00,N/A,N/A,N/A,N/A,N/A,N/A,N/A,N/A,N/A,N/A,N/A,[precise locality unknown],N/A,N/A,N/A,1058481,Typed,no type status,,
Entry 230,0270_C2000949F_collage.png,ex herb. George E. Hunt,G. E. Hunt,N/A,s.n.,N/A,1946-05-00,N/A,Sphagnum subsecundum,Sphagnum subsecundum,N/A,N/A,N/A,Scotland,N/A,N/A,N/A,Balde,Balde,N/A,N/A,N/A,1182976,Mix of Handwritten and Typed,no type status,,
Entry 231,0271_C2010614F_collage.png,M. Conrad,M. Conrad,N/A,76.1.8693,Le 18.07.1976,1976-07-18,N/A,"Pogonatum urnigerum G. Beauv., Schimp.",Pogonatum urnigerum,M. Conrad,N/A,Polytrichum urnigerum,Switzerland,Valais,Val d'Herens,N/A,"sur Falaise Smoselle, à La Forclaz","sur Falaise Smoselle, à La Forclaz",N/A,alt. ca. 1750 m,N/A,N/A,Mix of Handwritten and Typed,no type status,,
Entry 232,0272_C2010616F_collage.png,M. Onraedt,M. Onraedt,N/A,70.5.1880,Le 24 07 1976,1976-07-24,N/A,Pogonatum urnigerum B. Beauv. (Schimp.),Pogonatum urnigerum,N/A,Det. Jursy,N/A,Belgium,N/A,N/A,N/A,Cton du Palais Val d'Herens entre St. Martin et Mase,Cton du Palais Val d'Herens entre St. Martin et Mase,talus forestier,alt. 1600m,N/A,N/A,Mix of Handwritten and Typed,no type status,,
Entry 233,0273_C2010618F_collage.png,Barnes legit,N/A,N/A,s.n.,Feb. 1910,1910-02-00,N/A,Pogonatum urnigerum,Pogonatum urnigerum,N/A,N/A,N/A,United Kingdom,England,N/A,N/A,Westmoreland,[precise locality unknown],N/A,N/A,N/A,1058318,Mix of Handwritten and Typed,no type status,,
Entry 234,0274_C2010620F_collage.png,"Jack, Leiner u. Stizenberger",N/A,N/A,986A b.,25. August 1860,1860-08-25,N/A,Pogonatum urnigerum (L.) Pal. Beauv.,Pogonatum urnigerum,N/A,N/A,N/A,Germany,N/A,N/A,N/A,b. An Waldgraben bei Salem,[precise locality unknown],N/A,N/A,N/A,1054838,Mix of Handwritten and Typed,no type status,,
Entry 235,0275_C2010622F_collage.png,Dr. Hepp,N/A,N/A,986,17. October 1862,1862-10-17,N/A,Pogonatum urnigerum (L.) Pal. Beauv.,Pogonatum urnigerum,N/A,N/A,N/A,Germany,Baden-Württemberg,N/A,Degerfelden,An einem Waldrande auf dem rothen Sandsteinbruche oberhalb Degerfelden,[precise locality unknown],An einem Waldrande auf dem rothen Sandsteinbruche,N/A,N/A,1054981,Typed,no type status,,
Entry 236,0276_C2010624F_collage.png,"Jack, Lehner u. Stizenberger",N/A,N/A,9863 d,September 1862,1862-09-00,N/A,Pogonatum urnigerum (L.) Pal. Beauv.,Pogonatum urnigerum,N/A,N/A,N/A,Switzerland,Schaffhausen,N/A,N/A,d. In Hohlwegen bei Schaffhausen,In Hohlwegen,N/A,N/A,N/A,1055069,Typed,no type status,,
Entry 237,0277_C2010626F_collage.png,Coll. et determ. C. Jensen,C. Jensen,N/A,104,"November 21, 1904",1904-11-21,N/A,Pogonatum urnigerum (Hedw.) P. Beauv.,Pogonatum urnigerum,C. Jensen,N/A,N/A,Denmark,Zealand,N/A,N/A,sandy soil in Magistratskovene south of Hvalsø,Magistratskovene south of Hvalsø,sandy soil,N/A,N/A,N/A,Typed,no type status,,
Entry 238,0278_C2010974F_collage.png,P. Allorge,P. Allorge,N/A,49,"Paris, mai 1928",1928-05-00,N/A,Pogonatum urnigerum,Pogonatum urnigerum,P. Allorge,29. VIII. 1927,Blasia pusilla | Pellia epiphylla | A. acicularis | D. pellucidum | Rhytidiadelphus loreus,Spain,Navarra,N/A,N/A,Puerto de Ibañeta,Puerto de Ibañeta,talus argileux schisteux,Alt. ca. 1.050 m.,N/A,1200429,Typed,no type status,,
Entry 239,0279_C2010976F_collage.png,N/A,N/A,N/A,s.n.,JUN 1950,1950-06-00,N/A,N/A,N/A,N/A,N/A,N/A,N/A,N/A,N/A,N/A,N/A,[precise locality unknown],N/A,N/A,N/A,1350887,Typed,no type status,,
Entry 240,0280_C1042257F_collage.png,S. Churchill et al.,S. Churchill,H. Huaylla | R. Lozano | M. Serrano,22853,12 May 2004,2004-05-12,N/A,Neckera scabridens C. Müller,Neckera scabridens,S. Churchill,Jun 2004,N. chilensis | Prumnopitys exigua | Podocarpus | Myrcianthes,Bolivia,Chuquisaca,Belisario Boeto,N/A,Monte Grande ca. 32 km de Villa Serrano,Monte Grande approximately 32 kilometers from Villa Serrano,Bosque montano de yungas,2740 m,"18°43'43""S 64°29'07""W",<22845-22885>,Typed,no type status,,
Entry 241,0281_K000931304_collage.png,E. Córdula | Q. Melo | K. Pinheiro,E. Córdula,Q. Melo | K. Pinheiro,41243,23/VI/2007,2007-06-23,N/A,Vigna peduncularis (Kunth) Fawc. & Rendle,Ancistrotropis peduncularis,G. P. Lewis,12.2012,N/A,Brazil,Pernambuco,N/A,Mirandiba,Serra das Umburanas (afloramento rochoso),Serra das Umburanas,arbusto denso solo derivado de embasamento cristalino,457 m,8°12' S 38°32' W,K000931304,Mix of Handwritten and Typed,no type status,,
Entry 242,0282_EIG.6763_collage.png,Ilkka Kukkonen,I. Kukkonen,N/A,11003,13. Sept. 1981,1981-09-13,N/A,Arthropteris tenella (Forst. f.) J. Sm.,Arthropteris tenella,J. Sarvela,1982,N/A,Australia,Queensland,Atherton Tableland,N/A,"Lamin's Hill, E. of Malanda","Lamin's Hill, East of Malanda",Patch of rain forest. Fern climbing on tree stems.,N/A,N/A,EIG.6763,Typed,no type status,,
Entry 243,0283_K001046329_collage.png,Col. G. Pabst,G. Pabst,N/A,5121,7.9.60,1960-09-07,N/A,Avicennia tomentosa,Avicennia tomentosa,A. P. Duarte,23.9.60,N/A,Brazil,Guanabara,N/A,N/A,Mangue proximo ao Joquei Club da Ilha do Governador,Mangue proximo ao Joquei Club da Ilha do Governador,Arbusto e pequenas arvores de flores brancas,N/A,N/A,K001046329,Typed,no type status,,
Entry 244,0284_K000964719_collage.png,W. Hoehne,W. Hoehne,N/A,10228,13/9/33,1933-09-13,N/A,Cestrum corymbosum Schlecht.,Cestrum corymbosum,M. Kuhlmann,N/A,N/A,Brazil,São Paulo,N/A,N/A,Cantareiras: São Paulo,Cantareiras,N/A,Alt.: ...,N/A,K000964719,Mix of Handwritten and Typed,no type status,,
Entry 245,0285_EIG.5460_collage.png,leg. H. Eggert,H. Eggert,N/A,s.n.,17. Mai 79,1879-05-17,N/A,Cystopteris bulbifera (L.) Bernh.,Cystopteris bulbifera,N/A,N/A,N/A,United States,Illinois,N/A,N/A,Bluffs bei Illinois,Bluffs,N/A,N/A,N/A,EIG.5460,Mix of Handwritten and Typed,no type status,,
Entry 246,0286_EIG.435_collage.png,Ilkka Kukkonen 12608,I. Kukkonen,N/A,12608,8.XI.1982,1982-11-08,N/A,Dryopteris inaequalis (Schltdl.) O. Kuntze,Dryopteris inaequalis,J. Sarvela,1987,Festuca schimperiana | Euryops prostrata | Anthemis tigreensis | Juniperus procera,Ethiopia,Bale,N/A,N/A,"Bale Adm. Reg., Saneti plateau and Mount Batu",Saneti plateau and Mount Batu,"In alpine belt dominated by Festuca schimperiana, Euryops prostrata, Anthemis tigreensis. On the way to Saneti plateau from Robe. Steep forested slope of a river canyon, e.g. Juniperus procera. Pastured slope.",Alt. c. 3400 m. c. 4000-4200 m.,06°55'N; 39°40'E,H 1489737,Typed,no type status,,
Entry 247,0287_E00570050_collage.png,Vallejo-Marin M. 11-LED-seed-2.14,M. Vallejo-Marin,N/A,11-LED-seed-2.14,23 Mar 2012,2012-03-23,N/A,Mimulus peregrinus sp. nov.,Mimulus peregrinus,M. Vallejo-Marin | C. Lye | D. Barrigan,27 August 2011,Mimulus x robertsii,Scotland,South Lanarkshire,N/A,N/A,British Isles vc. 77 Shortcleuch Water Leadhills,Shortcleuch Water Leadhills,Occurring on the banks of a stream on a substrate of sand and shingle,360 m,N 55  A237 W 3 7349,E00570050,Mix of Handwritten and Typed,Holotype,,
Entry 248,0288_K000773283_collage.png,B. T. Lowne,B. T. Lowne,N/A,648,Aug. 9th 1902,1902-08-09,N/A,Monotropa Hypopitys,Monotropa hypopitys,Bentham,N/A,N/A,United Kingdom,Surrey,N/A,N/A,N/A,N/A,N/A,N/A,"45° 26' 1126""",K000773283,Mix of Handwritten and Typed,no type status,,
Entry 249,0289_BR0000006918378_collage.png,Bart Van de Vijver,B. Van de Vijver,N/A,s.n.,25/04/2007,2007-04-25,N/A,Ophrys oestrifera subsp. garganensis Van de Vijver & W. Van Looken,Ophrys oestrifera subsp. garganensis,unsure and check,unsure and check,Cistus | Pinus,Italy,Apulia,N/A,N/A,Promontorio del Gargano Madonna di Loreto Behind the Chapel of Madonna di Loreto,Promontorio del Gargano Madonna di Loreto Behind the Chapel of Madonna di Loreto,macchia-shrub with Cistus and Pinus,N/A,N/A,691837,Mix of Handwritten and Typed,no type status,,
Entry 250,0290_K001207911_collage.png,G. Hatschbach,G. Hatschbach,N/A,20590,9/11/1968,1968-11-09,N/A,Pfaffia glabrataoides Suess.,Pfaffia glabrataoides,T. M. Pedersen,971,N/A,Brazil,Parana,N/A,Curitiba,Rio Iguacu prox a barra do Perdido,Rio Iguacu near the mouth of Perdido,Terreno arenoso margens de rio,N/A,25G59G,K001207911,Mix of Handwritten and Typed,no type status,,
Entry 251,0291_K000263710_collage.png,"J. J. de Wilde, Sosef, K. van Nek",J. J. de Wilde,Sosef | K. van Nek,10130,22-1-1991,1991-01-22,N/A,Rhynchosia gabonensis Jongkind,Rhynchosia gabonensis,N/A,N/A,N/A,Gabon,N/A,N/A,N/A,About 10 km. on the road from Tchimbele to Assok,About 10 kilometers on the road from Tchimbele to Assok,Vine 7 meters long in tree in roadside Pods silvery-grey Seeds glossy dark blue Leaflets thick leathery dull green above beneath paler green with reddish nervation,Alt. ± 580 m.,0 04 N. 10 23 E.,K000263710,Typed,Isotype,,
Entry 252,0292_BM000934757_collage.png,WILHELM SUKSDORF,W. Suksdorf,N/A,12045,3. Aug. 1926.,1926-08-03,N/A,Solanum triflorum Nutt.,Solanum triflorum,T. Särkinen | M. Nee,2014 | 2005,N/A,United States,Washington,Klickitat,Bingen,High sandy riverbank at Bingen,High sandy riverbank,High sandy riverbank,N/A,N/A,N/A,Typed,no type status,,
Entry 253,0293_K000536956_collage.png,COLL. J. FRANCIS MACBRIDE,J. F. Macbride,N/A,5234,"AUG. 27-SEPT. 1, 1923",1923-08-27,1923-09-01,Isotype of Tococa undabunda J. F. Macbr.,Tococa undabunda,F. A. Michelangeli,20.08,N/A,Peru,N/A,N/A,La Merced,Montaña slope,Montaña slope,N/A,ABOUT 4000 FEET,N/A,N/A,Mix of Handwritten and Typed,Isotype,,
Entry 254,0294_B 10 0375227_collage.png,"X. Cornejo, C. Bonifaz",X. Cornejo,C. Bonifaz,5822,"Oct. 27, 1997",1997-10-27,N/A,Capparis sclerophylla Iltis nov. sp.,Capparis sclerophylla,unsure and check,19 JUL 2010,C. heterophylla | C. scabrida | C. lanceolata | C. crotonoides,Ecuador,Manabí,N/A,N/A,Prov. Manabí. Bahía de Caráquez a 8 Km. Alrededores de Universidad Católica,Bahía de Caráquez at 8 kilometers around Universidad Católica,"Bosque seco tropical deciduo, fuertemente intervenido",30,LATITUD -00.45 LONGITUD -80.32,B 10 0375227,Mix of Handwritten and Typed,Isotipo,,
Entry 255,0295_B 10 0185601_collage.png,M. l'Abbé Delavay,M. Delavay,N/A,s.n.,2 avril 1887,1887-04-02,N/A,Gentiana albescens Franch.,Gentiana albescens,unsure and check,N/A,N/A,China,Yunnan,N/A,N/A,collines prope Mo-so-yn,[precise locality unknown],N/A,N/A,N/A,B 10 0185601,Mix of Handwritten and Typed,no type status,,
Entry 256,0296_B 10 0030508_collage.png,col. Winfried Meier y Silvia Llamozas,W. Meier,S. Llamozas,3685,16-17 de abril 1993,1993-04-16,1993-04-17,Malmea dielsiana,Klarobelia subglobosa,C. Chatrou,comp. apr. 1999,N/A,Venezuela,Miranda,N/A,N/A,Cordillera de la Costa entre Curimagua y Guatire,Cordillera de la Costa entre Curimagua y Guatire,arbol caido secado en selva,500 m,lat. 10°34' N long. 66°23' O,B 10 0030508,Mix of Handwritten and Typed,Isotype,,
Entry 257,0297_B 10 0069251_collage.png,Kessler,M. Kessler,N/A,283,21.12.1988,1988-12-21,N/A,Mallotus paniculatus,Mallotus paniculatus,M. Kessler,N/A,N/A,Malaysia,Sarawak,N/A,N/A,Base of Gunung Pueh,Base of Gunung Pueh,Secondary vegetation along road,Alt. up to 200 m,N/A,B 10 0069251,Typed,no type status,,
Entry 258,0298_B 10 0279821_collage.png,M. Jacobs,M. Jacobs,N/A,5605,1958 Aug. 1,1958-08-01,N/A,Piptospatha grabowskii (Syn. P. havilandii (Engl. & K. Krause)),Piptospatha grabowskii,N/A,N/A,N/A,Malaysia,Sarawak,N/A,N/A,N. slopes of Mount Penrissen (S. of Kuching) approx. 1°5' N. 110°15' E. Primary forest on sandstone substratum,North slopes of Mount Penrissen South of Kuching,In very moist sandstone gorge on rocks. Inflor. sheath violet tip olive-greenish; male and female flowers sordidly pale yellow. Frequent on the spot. Pollinated by small blue-glossy beetles,c. 700-900 m.,approx. 1°5' N. 110°15' E.,159859,Typed,no type status,,
Entry 259,0299_B 10 0030420_collage.png,"P. J. M. & H. Maas, L. Kollmann",P. J. M. Maas,H. Maas | L. Kollmann,8833,16 Feb 1999,1999-02-16,N/A,Pseudoxandra spiritus-sancti Maas,Pseudoxandra spiritus-sancti,P. J. M. Maas,2001,N/A,Brazil,Espírito Santo,Santa Teresa,N/A,"Est. Espírito Santo, Municipio de Santa Teresa, Estação Biológica de Santa Lúcia",Estação Biológica de Santa Lúcia,"High forest, on brown sand; vegetation with many Palmae and terrestrial and epiphytic Bromeliaceae",800 m,19°58'S 40°32'W,B 10 0030420,Typed,Isotype,,
